PMID,Title,Authors,Citation,First Author,Journal/Book,Publication Year,Create Date,PMCID,NIHMS ID,DOI
"34363763","Computer-aided detection versus advanced imaging for detection of colorectal neoplasia: a systematic review and network meta-analysis","Spadaccini M, Iannone A, Maselli R, Badalamenti M, Desai M, Chandrasekar VT, Patel HK, Fugazza A, Pellegatta G, Galtieri PA, Lollo G, Carrara S, Anderloni A, Rex DK, Savevski V, Wallace MB, Bhandari P, Roesch T, Gralnek IM, Sharma P, Hassan C, Repici A.","Lancet Gastroenterol Hepatol. 2021 Oct;6(10):793-802. doi: 10.1016/S2468-1253(21)00215-6. Epub 2021 Aug 5.","Spadaccini M","Lancet Gastroenterol Hepatol","2021","2021/08/07","","","10.1016/S2468-1253(21)00215-6"
"27897461","Stability Development of Immediately Loaded Hybrid Self-Tapping Implants Inserted in the Posterior Maxilla: 1-Year Results of a Randomized Controlled Trial","Todorovic VS, Vasovic M, Beetge MM, van Zyl AW, Kokovic V.","J Oral Implantol. 2017 Feb;43(1):33-38. doi: 10.1563/aaid-joi-D-16-00143. Epub 2016 Nov 29.","Todorovic VS","J Oral Implantol","2017","2016/11/30","","","10.1563/aaid-joi-D-16-00143"
"27761668","Decrowding of lower anterior segment with and without photobiomodulation: a single center, randomized clinical trial","Nahas AZ, Samara SA, Rastegar-Lari TA.","Lasers Med Sci. 2017 Jan;32(1):129-135. doi: 10.1007/s10103-016-2094-5. Epub 2016 Oct 20.","Nahas AZ","Lasers Med Sci","2017","2016/10/21","","","10.1007/s10103-016-2094-5"
"35075079","The Effect of Music Therapy in Reducing Dental Anxiety and Lowering Physiological Stressors","Wazzan M, Estaitia M, Habrawi S, Mansour D, Jalal Z, Ahmed H, Hasan HA, Al Kawas S.","Acta Biomed. 2022 Jan 19;92(6):e2021393. doi: 10.23750/abm.v92i6.11668.","Wazzan M","Acta Biomed","2022","2022/01/25","PMC8823572","","10.23750/abm.v92i6.11668"
"15692120","Effects of fosinopril and pravastatin on carotid intima-media thickness in subjects with increased albuminuria","Asselbergs FW, van Roon AM, Hillege HL, de Jong PE, Gans RO, Smit AJ, van Gilst WH; PREVEND IT Investigators.","Stroke. 2005 Mar;36(3):649-53. doi: 10.1161/01.STR.0000155731.92786.e9. Epub 2005 Feb 3.","Asselbergs FW","Stroke","2005","2005/02/05","","","10.1161/01.STR.0000155731.92786.e9"
"35028722","Optimizing the Angiography Protocol to Reduce Radiation Dose in Uterine Artery Embolization: The Impact of Digital Subtraction Angiographies on Radiation Exposure","Cina A, Steri L, Barbieri P, Contegiacomo A, Amodeo EM, Di Stasi C, Morasca A, Romualdi D, Ciccarone F, Manfredi R.","Cardiovasc Intervent Radiol. 2022 Feb;45(2):249-254. doi: 10.1007/s00270-021-03032-8. Epub 2022 Jan 14.","Cina A","Cardiovasc Intervent Radiol","2022","2022/01/14","","","10.1007/s00270-021-03032-8"
"32524862","Effect of clarithromycin pre-treatment on the pharmacokinetics of metoclopramide after their simultaneous oral intake","Kaukab I, Shah SNH, Kharaba ZJ, Buabeid MA, Alfoteih YA, Murtaza G.","Expert Opin Drug Metab Toxicol. 2020 Aug;16(8):735-740. doi: 10.1080/17425255.2020.1779699.","Kaukab I","Expert Opin Drug Metab Toxicol","2020","2020/06/12","","","10.1080/17425255.2020.1779699"
"32196976","The Bioequivalence of Tafamidis 61-mg Free Acid Capsules and Tafamidis Meglumine 4 × 20-mg Capsules in Healthy Volunteers","Lockwood PA, Le VH, O'Gorman MT, Patterson TA, Sultan MB, Tankisheva E, Wang Q, Riley S.","Clin Pharmacol Drug Dev. 2020 Oct;9(7):849-854. doi: 10.1002/cpdd.789. Epub 2020 Mar 20.","Lockwood PA","Clin Pharmacol Drug Dev","2020","2020/03/21","PMC7754314","","10.1002/cpdd.789"
"23591663","Effects of mixed dietary supplements on total plasma homocysteine concentrations (tHcy): a randomized, double-blind, placebo-controlled trial","Gariballa SE, Forster SJ, Powers HJ.","Int J Vitam Nutr Res. 2012 Aug;82(4):260-6. doi: 10.1024/0300-9831/a000118.","Gariballa SE","Int J Vitam Nutr Res","2012","2013/04/18","","","10.1024/0300-9831/a000118"
"20075281","Uric acid, urea, and ammonia concentrations in serum and uric acid concentration in excreta as indicators of amino acid utilization in diets for broilers","Donsbough AL, Powell S, Waguespack A, Bidner TD, Southern LL.","Poult Sci. 2010 Feb;89(2):287-94. doi: 10.3382/ps.2009-00401.","Donsbough AL","Poult Sci","2010","2010/01/16","","","10.3382/ps.2009-00401"
"19232612","Uterine artery embolization versus laparoscopic occlusion of uterine vessels for management of symptomatic uterine fibroids","Ambat S, Mittal S, Srivastava DN, Misra R, Dadhwal V, Ghosh B.","Int J Gynaecol Obstet. 2009 May;105(2):162-5. doi: 10.1016/j.ijgo.2009.01.006. Epub 2009 Feb 20.","Ambat S","Int J Gynaecol Obstet","2009","2009/02/24","","","10.1016/j.ijgo.2009.01.006"
"23459407","Reduction in morning blood pressure is a key factor for ameliorating urinary albumin excretion in patients with morning hypertension irrespective of treatment regimen","Kai H, Kaneyuki M, Shihara M, Toyama Y, Mitsutake Y, Umei H, Kusaba K, Ueda T, Adachi H, Imaizumi T; MAPPY Study Investigators.","Circ J. 2013;77(6):1551-7. doi: 10.1253/circj.cj-12-1102. Epub 2013 Mar 2.","Kai H","Circ J","2013","2013/03/06","","","10.1253/circj.cj-12-1102"
"32114796","Comprehensive Evaluation of Rhythm Monitoring Strategies in Screening for Atrial Fibrillation: Insights From Patients at Risk Monitored Long Term With an Implantable Loop Recorder","Diederichsen SZ, Haugan KJ, Kronborg C, Graff C, Højberg S, Køber L, Krieger D, Holst AG, Nielsen JB, Brandes A, Svendsen JH.","Circulation. 2020 May 12;141(19):1510-1522. doi: 10.1161/CIRCULATIONAHA.119.044407. Epub 2020 Mar 2.","Diederichsen SZ","Circulation","2020","2020/03/03","","","10.1161/CIRCULATIONAHA.119.044407"
"32533264","Immediate versus delayed loading of strategic mini-implants under existing removable partial dentures: patient satisfaction in a multi-center randomized clinical trial","Al Jaghsi A, Heinemann F, Biffar R, Mundt T.","Clin Oral Investig. 2021 Jan;25(1):255-264. doi: 10.1007/s00784-020-03360-y. Epub 2020 Jun 12.","Al Jaghsi A","Clin Oral Investig","2021","2020/06/14","","","10.1007/s00784-020-03360-y"
"34086481","Response to Induction Neoadjuvant Hormonal Therapy Using Upfront 21-Gene Breast Recurrence Score Assay-Results From the SAFIA Phase III Trial","AlSaleh K, Al Zahwahry H, Bounedjar A, Oukkal M, Saadeddine A, Mahfouf H, Bouzid K, Bensalem A, Filali T, Abdel-Razeq H, Larbaoui B, Kandil A, Abulkhair O, Al Foheidi M, Errihani H, Ghosn M, Abdel-Aziz N, Arafah M, Boussen H, Dabouz F, Rasool H, Bahadoor M, Ayari J, Kullab S, Nabholtz JM.","JCO Glob Oncol. 2021 Jun;7:811-819. doi: 10.1200/GO.20.00575.","AlSaleh K","JCO Glob Oncol","2021","2021/06/04","PMC8457874","","10.1200/GO.20.00575"
"28853131","Implementation of a peer-mediated health education model in the United Arab Emirates: addressing risky behaviours among expatriate adolescents","Stanley ZD, Asfour LW, Weitzman M, Sherman SE.","East Mediterr Health J. 2017 Aug 27;23(7):480-485. doi: 10.26719/2017.23.7.480.","Stanley ZD","East Mediterr Health J","2017","2017/08/31","","","10.26719/2017.23.7.480"
"18413195","Beta-blockers have a beneficial effect upon endothelial function and microalbuminuria in African-American subjects with diabetes and hypertension","Jawa A, Nachimuthu S, Pendergrass M, Asnani S, Fonseca V.","J Diabetes Complications. 2008 Sep-Oct;22(5):303-8. doi: 10.1016/j.jdiacomp.2007.05.003. Epub 2008 Apr 16.","Jawa A","J Diabetes Complications","2008","2008/04/17","PMC2590589","NIHMS69371","10.1016/j.jdiacomp.2007.05.003"
"32862098","Burden of diabetes mellitus and its impact on COVID-19 patients: A meta-analysis of real-world evidence","Hussain S, Baxi H, Chand Jamali M, Nisar N, Hussain MS.","Diabetes Metab Syndr. 2020 Nov-Dec;14(6):1595-1602. doi: 10.1016/j.dsx.2020.08.014. Epub 2020 Aug 20.","Hussain S","Diabetes Metab Syndr","2020","2020/08/31","PMC7439970","","10.1016/j.dsx.2020.08.014"
"25483023","Similar glucose control with basal-bolus regimen of insulin detemir plus insulin aspart and thrice-daily biphasic insulin aspart 30 in insulin-naive patients with type 2 diabetes: Results of a 50-week randomized clinical trial of stepwise insulin intensification","Malek R, Ajili F, Assaad-Khalil SH, Shinde A, Chen JW, Van den Berg E.","Diabetes Metab. 2015 Jun;41(3):223-30. doi: 10.1016/j.diabet.2014.11.002. Epub 2014 Dec 4.","Malek R","Diabetes Metab","2015","2014/12/09","","","10.1016/j.diabet.2014.11.002"
"16750458","Cost-effectiveness of screening for albuminuria with subsequent fosinopril treatment to prevent cardiovascular events: A pharmacoeconomic analysis linked to the prevention of renal and vascular endstage disease (PREVEND) study and the prevention of renal and vascular endstage disease intervention trial (PREVEND IT)","Atthobari J, Asselbergs FW, Boersma C, de Vries R, Hillege HL, van Gilst WH, Gansevoort RT, de Jong PE, de Jong-van den Berg LT, Postma MJ; PREVEND IT Study Group.","Clin Ther. 2006 Mar;28(3):432-44. doi: 10.1016/j.clinthera.2006.03.012.","Atthobari J","Clin Ther","2006","2006/06/06","","","10.1016/j.clinthera.2006.03.012"
"18211656","Pharmaceutical care of patients with gestational diabetes mellitus","Elnour AA, El Mugammar IT, Jaber T, Revel T, McElnay JC.","J Eval Clin Pract. 2008 Feb;14(1):131-40. doi: 10.1111/j.1365-2753.2007.00819.x.","Elnour AA","J Eval Clin Pract","2008","2008/01/24","","","10.1111/j.1365-2753.2007.00819.x"
"34871037","How Strong Is the Evidence Supporting Thromboprophylaxis in Surgical Oncology?","Klemen ND, Feingold PL, Hashimoto B.","J Clin Oncol. 2022 Feb 1;40(4):320-323. doi: 10.1200/JCO.21.01934. Epub 2021 Dec 6.","Klemen ND","J Clin Oncol","2022","2021/12/06","","","10.1200/JCO.21.01934"
"15509026","Pharmacokinetics and pharmacodynamics of dexamethasone after intravenous administration in camels: effect of dose","Al Katheeri NA, Wasfi IA, Lambert M, Saeed A.","Vet Res Commun. 2004 Aug;28(6):525-42. doi: 10.1023/b:verc.0000040243.30199.1f.","Al Katheeri NA","Vet Res Commun","2004","2004/10/29","","","10.1023/b:verc.0000040243.30199.1f"
"27080806","Play distraction versus pharmacological treatment to reduce anxiety levels in children undergoing day surgery: a randomized controlled non-inferiority trial","Al-Yateem N, Brenner M, Shorrab AA, Docherty C.","Child Care Health Dev. 2016 Jul;42(4):572-81. doi: 10.1111/cch.12343. Epub 2016 Apr 14.","Al-Yateem N","Child Care Health Dev","2016","2016/04/16","","","10.1111/cch.12343"
"34710709","Impacts of onion and cinnamon supplementation as natural additives on the performance, egg quality, and immunity in laying Japanese quail","Dosoky WM, Zeweil HS, Ahmed MH, Zahran SM, Shaalan MM, Abdelsalam NR, Abdel-Moneim AE, Taha AE, El-Tarabily KA, Abd El-Hack ME.","Poult Sci. 2021 Dec;100(12):101482. doi: 10.1016/j.psj.2021.101482. Epub 2021 Sep 17.","Dosoky WM","Poult Sci","2021","2021/10/28","PMC8560991","","10.1016/j.psj.2021.101482"
"11796177","Effect of captopril or imidapril on the progression of diabetic nephropathy in Japanese with type 1 diabetes mellitus: a randomized controlled study (JAPAN-IDDM)","Katayama S, Kikkawa R, Isogai S, Sasaki N, Matsuura N, Tajima N, Urakami T, Uchigata Y, Ohashi Y.","Diabetes Res Clin Pract. 2002 Feb;55(2):113-21. doi: 10.1016/s0168-8227(01)00289-3.","Katayama S","Diabetes Res Clin Pract","2002","2002/02/14","","","10.1016/s0168-8227(01)00289-3"
"25654309","Lung Volume Reduction in Emphysema Improves Chest Wall Asynchrony","Zoumot Z, LoMauro A, Aliverti A, Nelson C, Ward S, Jordan S, Polkey MI, Shah PL, Hopkinson NS.","Chest. 2015 Jul;148(1):185-195. doi: 10.1378/chest.14-2380.","Zoumot Z","Chest","2015","2015/02/06","PMC4493874","","10.1378/chest.14-2380"
"19258723","Add-on benefits of amlodipine and thiazide in nondiabetic chronic kidney disease stage 1/2 patients treated with valsartan","Kaneshiro Y, Ichihara A, Sakoda M, Kurauchi-Mito A, Kinouchi K, Itoh H.","Kidney Blood Press Res. 2009;32(1):51-8. doi: 10.1159/000205521. Epub 2009 Mar 4.","Kaneshiro Y","Kidney Blood Press Res","2009","2009/03/05","","","10.1159/000205521"
"29221717","Effect of metformin combined with lifestyle modification versus lifestyle modification alone on proinflammatory-oxidative status in drug-naïve pre-diabetic and diabetic patients: A randomized controlled study","Bulatova N, Kasabri V, Qotineh A, Al-Athami T, Yousef AM, AbuRuz S, Momani M, Zayed A.","Diabetes Metab Syndr. 2018 May;12(3):257-267. doi: 10.1016/j.dsx.2017.11.003. Epub 2017 Nov 23.","Bulatova N","Diabetes Metab Syndr","2018","2017/12/10","","","10.1016/j.dsx.2017.11.003"
"25853697","Endobronchial coils for severe emphysema are effective up to 12 months following treatment: medium term and cross-over results from a randomised controlled trial","Zoumot Z, Kemp SV, Singh S, Bicknell SR, McNulty WH, Hopkinson NS, Ross ET, Shah PL.","PLoS One. 2015 Apr 8;10(4):e0122656. doi: 10.1371/journal.pone.0122656. eCollection 2015.","Zoumot Z","PLoS One","2015","2015/04/09","PMC4390222","","10.1371/journal.pone.0122656"
"26968844","Assessment of clinical efficacy and safety in a randomized double-blind study of etanercept and sulfasalazine in patients with ankylosing spondylitis from Eastern/Central Europe, Latin America, and Asia","Damjanov N, Shehhi WA, Huang F, Kotak S, Burgos-Vargas R, Shirazy K, Bananis E, Szumski A, Llamado LJ, Mahgoub E.","Rheumatol Int. 2016 May;36(5):643-51. doi: 10.1007/s00296-016-3452-0. Epub 2016 Mar 11.","Damjanov N","Rheumatol Int","2016","2016/03/13","","","10.1007/s00296-016-3452-0"
"24398446","Vascular surgery research in the Gulf Cooperation Council countries","Jawas A, Hefny AF, Abbas AK, Abu-Zidan FM.","Asian J Surg. 2014 Apr;37(2):100-5. doi: 10.1016/j.asjsur.2013.11.001. Epub 2014 Jan 4.","Jawas A","Asian J Surg","2014","2014/01/09","","","10.1016/j.asjsur.2013.11.001"
"21796123","Angiotensin II receptor blocker and long-acting calcium channel blocker combination therapy decreases urinary albumin excretion while maintaining glomerular filtration rate","Nakagawa N, Fujino T, Kabara M, Matsuki M, Chinda J, Kikuchi K, Hasebe N; NICE-Combi Study Group.","Hypertens Res. 2011 Oct;34(10):1121-6. doi: 10.1038/hr.2011.101. Epub 2011 Jul 28.","Nakagawa N","Hypertens Res","2011","2011/07/29","","","10.1038/hr.2011.101"
"23112824","Favorable changes in lipid profile: the effects of fasting after Ramadan","Shehab A, Abdulle A, El Issa A, Al Suwaidi J, Nagelkerke N.","PLoS One. 2012;7(10):e47615. doi: 10.1371/journal.pone.0047615. Epub 2012 Oct 24.","Shehab A","PLoS One","2012","2012/11/01","PMC3480413","","10.1371/journal.pone.0047615"
"33600105","Body position and the effectiveness of mask ventilation in anaesthetised paralysed obese patients: A randomised cross-over study","Chang JE, Seol T, Hwang JY.","Eur J Anaesthesiol. 2021 Aug 1;38(8):825-830. doi: 10.1097/EJA.0000000000001473.","Chang JE","Eur J Anaesthesiol","2021","2021/02/18","","","10.1097/EJA.0000000000001473"
"21635992","Effects of varenicline in adult smokers: a multinational, 24-week, randomized, double-blind, placebo-controlled study","Bolliger CT, Issa JS, Posadas-Valay R, Safwat T, Abreu P, Correia EA, Park PW, Chopra P.","Clin Ther. 2011 Apr;33(4):465-77. doi: 10.1016/j.clinthera.2011.04.013.","Bolliger CT","Clin Ther","2011","2011/06/04","","","10.1016/j.clinthera.2011.04.013"
"12911866","Intrapulmonary administration of natural honey solution, hyperosmolar dextrose or hypoosmolar distill water to normal individuals and to patients with type-2 diabetes mellitus or hypertension: their effects on blood glucose level, plasma insulin and C-peptide, blood pressure and peaked expiratory flow rate","Al-Waili N.","Eur J Med Res. 2003 Jul 31;8(7):295-303.","Al-Waili N","Eur J Med Res","2003","2003/08/13","","",""
"21641365","Long-term effects of fosinopril and pravastatin on cardiovascular events in subjects with microalbuminuria:Ten years of follow-up of Prevention of Renal and Vascular End-stage Disease Intervention Trial (PREVEND IT)","Brouwers FP, Asselbergs FW, Hillege HL, de Boer RA, Gansevoort RT, van Veldhuisen DJ, van Gilst WH.","Am Heart J. 2011 Jun;161(6):1171-8. doi: 10.1016/j.ahj.2011.03.028. Epub 2011 May 11.","Brouwers FP","Am Heart J","2011","2011/06/07","","","10.1016/j.ahj.2011.03.028"
"34942864","Key Challenges and Future Directions When Running Auditory Brainstem Response (ABR) Research Protocols with Newborns: A Music and Language EEG Feasibility Study","Papatzikis E, Elhalik M, Inocencio SAM, Agapaki M, Selvan RN, Muhammed FS, Haroon NA, Dash SK, Sofologi M, Bezoni A.","Brain Sci. 2021 Nov 26;11(12):1562. doi: 10.3390/brainsci11121562.","Papatzikis E","Brain Sci","2021","2021/12/24","PMC8699561","","10.3390/brainsci11121562"
"29288963","Antioxidant reserve of the lungs and ventilator-associated pneumonia: A clinical trial of high dose selenium in critically ill patients","Mahmoodpoor A, Hamishehkar H, Sanaie S, Behruzizad N, Iranpour A, Koleini E, Nader ND.","J Crit Care. 2018 Apr;44:357-362. doi: 10.1016/j.jcrc.2017.12.016. Epub 2017 Dec 24.","Mahmoodpoor A","J Crit Care","2018","2017/12/31","","","10.1016/j.jcrc.2017.12.016"
"17360767","Impact of weight change on albuminuria in the general population","Bello AK, de Zeeuw D, El Nahas M, Brantsma AH, Bakker SJ, de Jong PE, Gansevoort RT.","Nephrol Dial Transplant. 2007 Jun;22(6):1619-27. doi: 10.1093/ndt/gfm091. Epub 2007 Mar 14.","Bello AK","Nephrol Dial Transplant","2007","2007/03/16","","","10.1093/ndt/gfm091"
"31501124","A single-centre investigator-blinded randomised parallel group clinical trial to investigate the effect of probiotic strains Streptococcus salivarius M18 and Lactobacillus acidophilus on gingival health of paediatric patients undergoing treatment with fixed orthodontic appliances: study protocol","Kaklamanos EG, Nassar R, Kalfas S, Al Halabi M, Kowash M, Hannawi H, Hussein I, Salami A, Hassan A, Senok AC.","BMJ Open. 2019 Sep 8;9(9):e030638. doi: 10.1136/bmjopen-2019-030638.","Kaklamanos EG","BMJ Open","2019","2019/09/11","PMC6738688","","10.1136/bmjopen-2019-030638"
"19589901","A safety and feasibility study comparing an intermittent high dose with a daily standard dose of liposomal amphotericin B for persistent neutropenic fever","Ellis M, Bernsen R, Ali-Zadeh H, Kristensen J, Hedström U, Poughias L, Bresnik M, Al-Essa A, A Stevens D.","J Med Microbiol. 2009 Nov;58(Pt 11):1474-1485. doi: 10.1099/jmm.0.012401-0. Epub 2009 Jul 9.","Ellis M","J Med Microbiol","2009","2009/07/11","","","10.1099/jmm.0.012401-0"
"12865039","The BErgamo NEphrologic DIabetes Complications Trial (BENEDICT): design and baseline characteristics","BENEDICT Group.","Control Clin Trials. 2003 Aug;24(4):442-61. doi: 10.1016/s0197-2456(03)00028-x.","BENEDICT Group","Control Clin Trials","2003","2003/07/17","","","10.1016/s0197-2456(03)00028-x"
"19552750","Influence of pharmaceutical care on health outcomes in patients with Type 2 diabetes mellitus","Al Mazroui NR, Kamal MM, Ghabash NM, Yacout TA, Kole PL, McElnay JC.","Br J Clin Pharmacol. 2009 May;67(5):547-57. doi: 10.1111/j.1365-2125.2009.03391.x. Epub 2009 Feb 11.","Al Mazroui NR","Br J Clin Pharmacol","2009","2009/06/26","PMC2686072","","10.1111/j.1365-2125.2009.03391.x"
"29283072","Onset of Hypertension in Leflunamide Treated Low Socioeconomic Rheumatoid Arthritis Patients: An Unseen Iceberg","Ishaq M, Razzaque S, Shohail F, Kumar A, Muhammad JS.","Curr Rheumatol Rev. 2019;15(3):242-245. doi: 10.2174/1573397114666171227211048.","Ishaq M","Curr Rheumatol Rev","2019","2017/12/29","","","10.2174/1573397114666171227211048"
"28230596","The Efficacy of Immediate Implant Placement in Extraction Sockets for Alveolar Bone Preservation: A Clinical Evaluation Using Three-Dimensional Cone Beam Computerized Tomography and Resonance Frequency Analysis Value","Qabbani AA, Razak NHA, Kawas SA, Sheikh Abdul Hamid S, Wahbi S, Samsudin AR.","J Craniofac Surg. 2017 Jun;28(4):e318-e325. doi: 10.1097/SCS.0000000000003569.","Qabbani AA","J Craniofac Surg","2017","2017/02/24","","","10.1097/SCS.0000000000003569"
"23886155","Oral cancer awareness and perception of tobacco use cessation counseling among dental students in four Asian countries","Halawany HS, Jacob V, Abraham NB, Al-Maflehi N.","Asian Pac J Cancer Prev. 2013;14(6):3619-23. doi: 10.7314/apjcp.2013.14.6.3619.","Halawany HS","Asian Pac J Cancer Prev","2013","2013/07/27","","","10.7314/apjcp.2013.14.6.3619"
"26426627","Effects of ACEIs Versus ARBs on Proteinuria or Albuminuria in Primary Hypertension: A Meta-Analysis of Randomized Trials","Xu R, Sun S, Huo Y, Yun L, Huang S, Li G, Yan S.","Medicine (Baltimore). 2015 Sep;94(39):e1560. doi: 10.1097/MD.0000000000001560.","Xu R","Medicine (Baltimore)","2015","2015/10/02","PMC4616860","","10.1097/MD.0000000000001560"
"25395906","Leaf concentrate fortification of antenatal protein-calorie snacks improves pregnancy outcomes","Magon A, Collin SM, Joshi P, Davys Late G, Attlee A, Mathur B.","J Health Popul Nutr. 2014 Sep;32(3):430-40.","Magon A","J Health Popul Nutr","2014","2014/11/15","PMC4221449","",""
"33418065","The ratio of eicosapentaenoic acid to docosahexaenoic acid as a modulator for the cardio-metabolic effects of omega-3 supplements: A meta-regression of randomized clinical trials","AbuMweis S, Abu Omran D, Al-Shami I, Jew S.","Complement Ther Med. 2021 Mar;57:102662. doi: 10.1016/j.ctim.2021.102662. Epub 2021 Jan 5.","AbuMweis S","Complement Ther Med","2021","2021/01/08","","","10.1016/j.ctim.2021.102662"
"16567671","Uterine artery embolization in the treatment of symptomatic uterine fibroid tumors (EMMY trial): periprocedural results and complications","Volkers NA, Hehenkamp WJ, Birnie E, de Vries C, Holt C, Ankum WM, Reekers JA.","J Vasc Interv Radiol. 2006 Mar;17(3):471-80. doi: 10.1097/01.rvi.0000203419.61593.84.","Volkers NA","J Vasc Interv Radiol","2006","2006/03/29","","","10.1097/01.rvi.0000203419.61593.84"
"26589371","Essential phospholipids as a supportive adjunct in the management of patients with NAFLD","Dajani AI, Abu Hammour AM, Zakaria MA, Al Jaberi MR, Nounou MA, Semrin AI.","Arab J Gastroenterol. 2015 Sep-Dec;16(3-4):99-104. doi: 10.1016/j.ajg.2015.09.001. Epub 2015 Nov 14.","Dajani AI","Arab J Gastroenterol","2015","2015/11/22","","","10.1016/j.ajg.2015.09.001"
"28460562","Treatment duration and gingival inflammation in Angle's Class I malocclusion patients treated with the conventional straight-wire method and the Damon technique: a single-centre, randomised clinical trial","Kaklamanos EG, Mavreas D, Tsalikis L, Karagiannis V, Athanasiou AE.","J Orthod. 2017 Jun;44(2):75-81. doi: 10.1080/14653125.2017.1316902. Epub 2017 May 1.","Kaklamanos EG","J Orthod","2017","2017/05/03","","","10.1080/14653125.2017.1316902"
"28243855","Optimal propofol induction dose in morbidly obese patients: A randomized controlled trial comparing the bispectral index and lean body weight scalar","Subramani Y, Riad W, Chung F, Wong J.","Can J Anaesth. 2017 May;64(5):471-479. doi: 10.1007/s12630-017-0852-x. Epub 2017 Feb 27.","Subramani Y","Can J Anaesth","2017","2017/03/01","","","10.1007/s12630-017-0852-x"
"19464709","[Effect of pentoxifylline on the evolution of diabetic nephropathy]","Leyva-Jiménez R, Rodríguez-Orozco AR, Ortega-Pierres LE, Ramírez-Enríquez J, Gómez-García A, Alvarez-Aguilar C.","Med Clin (Barc). 2009 May 30;132(20):772-8. doi: 10.1016/j.medcli.2008.05.024. Epub 2009 May 22.","Leyva-Jiménez R","Med Clin (Barc)","2009","2009/05/26","","","10.1016/j.medcli.2008.05.024"
"25065855","A prospective randomized wait list control trial of intravenous iron sucrose in older adults with unexplained anemia and serum ferritin 20-200 ng/mL","Price E, Artz AS, Barnhart H, Sapp S, Chelune G, Ershler WB, Walston JD, Gordeuk VR, Berger NA, Reuben D, Prchal J, Rao SV, Roy CN, Supiano MA, Schrier SL, Cohen HJ.","Blood Cells Mol Dis. 2014 Dec;53(4):221-30. doi: 10.1016/j.bcmd.2014.06.003. Epub 2014 Jul 25.","Price E","Blood Cells Mol Dis","2014","2014/07/29","PMC4198614","NIHMS616481","10.1016/j.bcmd.2014.06.003"
"19527897","Uterine artery embolization compared with methotrexate for the management of pregnancy implanted within a cesarean scar","Zhuang Y, Huang L.","Am J Obstet Gynecol. 2009 Aug;201(2):152.e1-3. doi: 10.1016/j.ajog.2009.04.038. Epub 2009 Jun 13.","Zhuang Y","Am J Obstet Gynecol","2009","2009/06/17","","","10.1016/j.ajog.2009.04.038"
"32302665","Safety of lixisenatide plus basal insulin treatment regimen in Indian people with type 2 diabetes mellitus during Ramadan fast: A post hoc analysis of the LixiRam randomized trial","Sahay R, Hafidh K, Djaballah K, Coudert M, Azar S, Shehadeh N, Hanif W, Hassanein M.","Diabetes Res Clin Pract. 2020 May;163:108148. doi: 10.1016/j.diabres.2020.108148. Epub 2020 Apr 14.","Sahay R","Diabetes Res Clin Pract","2020","2020/04/18","","","10.1016/j.diabres.2020.108148"
"26636542","Antihypertensive treatments in adult autosomal dominant polycystic kidney disease: network meta-analysis of the randomized controlled trials","Xue C, Zhou C, Dai B, Yu S, Xu C, Mao Z, Ye C, Chen D, Zhao X, Wu J, Chen W, Mei C.","Oncotarget. 2015 Dec 15;6(40):42515-29. doi: 10.18632/oncotarget.6452.","Xue C","Oncotarget","2015","2015/12/05","PMC4767449","","10.18632/oncotarget.6452"
"16042672","Pharmaceutical care of patients with heart failure","Sadik A, Yousif M, McElnay JC.","Br J Clin Pharmacol. 2005 Aug;60(2):183-93. doi: 10.1111/j.1365-2125.2005.02387.x.","Sadik A","Br J Clin Pharmacol","2005","2005/07/27","PMC1884928","","10.1111/j.1365-2125.2005.02387.x"
"20640511","Over-the-counter sales of antibiotics from community pharmacies in Abu Dhabi","Dameh M, Green J, Norris P.","Pharm World Sci. 2010 Oct;32(5):643-50. doi: 10.1007/s11096-010-9418-5. Epub 2010 Jul 18.","Dameh M","Pharm World Sci","2010","2010/07/20","","","10.1007/s11096-010-9418-5"
