PMID,Title,Authors,Citation,First Author,Journal/Book,Publication Year,Create Date,PMCID,NIHMS ID,DOI
"21481151","Randomised comparison of uterine artery embolisation (UAE) with surgical treatment in patients with symptomatic uterine fibroids (REST trial): 5-year results","Moss JG, Cooper KG, Khaund A, Murray LS, Murray GD, Wu O, Craig LE, Lumsden MA.","BJOG. 2011 Jul;118(8):936-44. doi: 10.1111/j.1471-0528.2011.02952.x. Epub 2011 Apr 12.","Moss JG","BJOG","2011","2011/04/13","","","10.1111/j.1471-0528.2011.02952.x"
"11131271","Comparison of long-term therapeutic effect of an ACE inhibitor, temocapril, with that of a diuretic on microalbuminuria in non-diabetic essential hypertension","Shionoiri H, Kosaka T, Kita E, Takizawa T, Takasaki I.","Hypertens Res. 2000 Nov;23(6):593-600. doi: 10.1291/hypres.23.593.","Shionoiri H","Hypertens Res","2000","2000/12/29","","","10.1291/hypres.23.593"
"17662509","Effects of dietary supplements on depressive symptoms in older patients: a randomised double-blind placebo-controlled trial","Gariballa S, Forster S.","Clin Nutr. 2007 Oct;26(5):545-51. doi: 10.1016/j.clnu.2007.06.007. Epub 2007 Jul 26.","Gariballa S","Clin Nutr","2007","2007/07/31","","","10.1016/j.clnu.2007.06.007"
"12859696","Effects of losartan on diabetic maculopathy in type 2 diabetic patients: a randomized, double-masked study","Knudsen ST, Bek T, Poulsen PL, Hove MN, Rehling M, Mogensen CE.","J Intern Med. 2003 Aug;254(2):147-58. doi: 10.1046/j.1365-2796.2003.01192.x.","Knudsen ST","J Intern Med","2003","2003/07/16","","","10.1046/j.1365-2796.2003.01192.x"
"29300110","Impact of a pharmacist-provided information booklet on knowledge and attitudes towards oral contraception among Jordanian women: an interventional study","Akour A, Bardaweel S, Awwad O, Al-Muhaissen S, Hussein R.","Eur J Contracept Reprod Health Care. 2017 Dec;22(6):459-464. doi: 10.1080/13625187.2017.1412425. Epub 2018 Jan 4.","Akour A","Eur J Contracept Reprod Health Care","2017","2018/01/05","","","10.1080/13625187.2017.1412425"
"25564797","A randomized, prospective, blinded, split-face, single-center study comparing polycaprolactone to hyaluronic acid for treatment of nasolabial folds","Galadari H, van Abel D, Al Nuami K, Al Faresi F, Galadari I.","J Cosmet Dermatol. 2015 Mar;14(1):27-32. doi: 10.1111/jocd.12126. Epub 2015 Jan 6.","Galadari H","J Cosmet Dermatol","2015","2015/01/08","","","10.1111/jocd.12126"
"26862008","Effect of meal frequency on glucose and insulin levels in women with polycystic ovary syndrome: a randomised trial","Papakonstantinou E, Kechribari I, Mitrou P, Trakakis E, Vassiliadi D, Georgousopoulou E, Zampelas A, Kontogianni MD, Dimitriadis G.","Eur J Clin Nutr. 2016 May;70(5):588-94. doi: 10.1038/ejcn.2015.225. Epub 2016 Feb 10.","Papakonstantinou E","Eur J Clin Nutr","2016","2016/02/11","","","10.1038/ejcn.2015.225"
"16644288","Modulation of the systemic inflammatory response by recombinant human interleukin-11: a prospective randomized placebo controlled clinical study in patients with hematological malignancy","Ellis M, Hedstrom U, Frampton C, Alizadeh H, Kristensen J, Shammas FV, al-Ramadi BK.","Clin Immunol. 2006 Aug;120(2):129-37. doi: 10.1016/j.clim.2006.03.003. Epub 2006 Apr 27.","Ellis M","Clin Immunol","2006","2006/04/29","","","10.1016/j.clim.2006.03.003"
"29641584","Know your neighbor: The impact of social context on fairness behavior","Sircar N, Turley T, van der Windt P, Voors M.","PLoS One. 2018 Apr 11;13(4):e0194037. doi: 10.1371/journal.pone.0194037. eCollection 2018.","Sircar N","PLoS One","2018","2018/04/12","PMC5894984","","10.1371/journal.pone.0194037"
"25669986","Immunological response and overall survival in a subset of advanced renal cell carcinoma patients from a randomized phase 2/3 study of naptumomab estafenatox plus IFN-α versus IFN-α","Elkord E, Burt DJ, Sundstedt A, Nordle Ö, Hedlund G, Hawkins RE.","Oncotarget. 2015 Feb 28;6(6):4428-39. doi: 10.18632/oncotarget.2922.","Elkord E","Oncotarget","2015","2015/02/12","PMC4414201","","10.18632/oncotarget.2922"
"24195786","Effect of imidapril versus ramipril on urinary albumin excretion in hypertensive patients with type 2 diabetes and microalbuminuria","Fogari R, Mugellini A, Zoppi A, Gualtierotti R, Lazzari P, Derosa G, D'Angelo A.","Expert Opin Pharmacother. 2013 Dec;14(18):2463-73. doi: 10.1517/14656566.2013.848195. Epub 2013 Nov 7.","Fogari R","Expert Opin Pharmacother","2013","2013/11/08","","","10.1517/14656566.2013.848195"
"15683768","Comparison of the effect of Sporobolus virginicus and Rhodes (Chloris gayana) hay diets on the absorption pattern of phenylbutazone in the camel (Camelus dromedarius)","Abdel Hadi AA, Wasfi IA, Elghazali M, Almahrami AM, Barezaiq IM, Alkatheeri NA, Alhadrami GA.","Vet J. 2005 Jan;169(1):91-6. doi: 10.1016/j.tvjl.2003.12.004.","Abdel Hadi AA","Vet J","2005","2005/02/03","","","10.1016/j.tvjl.2003.12.004"
"11350567","Lisinopril reduces albuminuria during exercise in low grade microalbuminuric type 1 diabetic patients: a double blind randomized study","Poulsen PL, Ebbehøj E, Mogensen CE.","J Intern Med. 2001 May;249(5):433-40. doi: 10.1046/j.1365-2796.2001.00821.x.","Poulsen PL","J Intern Med","2001","2001/05/15","","","10.1046/j.1365-2796.2001.00821.x"
"11343813","Efficacy and safety of repeated postoperative administration of intramuscular diclofenac sodium in the treatment of post-cesarean section pain: a double-blind study","Al-Waili NS.","Arch Med Res. 2001 Mar-Apr;32(2):148-54. doi: 10.1016/s0188-4409(01)00254-5.","Al-Waili NS","Arch Med Res","2001","2001/05/10","","","10.1016/s0188-4409(01)00254-5"
"20001457","Comparison of effects of low dose of spironolactone and a thiazide diuretic in patients with hypertension treated with an angiotensin-converting enzyme inhibitor or an angiotensin type 1 receptor blocker","Yutaka M, Mifune M, Kubota E, Itoh H, Saito I.","Clin Exp Hypertens. 2009 Nov;31(8):648-56. doi: 10.3109/10641960903407017.","Yutaka M","Clin Exp Hypertens","2009","2009/12/17","","","10.3109/10641960903407017"
"11437862","Effect of troglitazone on urinary albumin excretion and serum type IV collagen concentrations in Type 2 diabetic patients with microalbuminuria or macroalbuminuria","Nakamura T, Ushiyama C, Suzuki S, Shimada N, Sekizuka K, Ebihara L, Koide H.","Diabet Med. 2001 Apr;18(4):308-13. doi: 10.1046/j.1464-5491.2001.00463.x.","Nakamura T","Diabet Med","2001","2001/07/05","","","10.1046/j.1464-5491.2001.00463.x"
"18818095","Pelvic pain after uterine artery embolization: a prospective randomized study of polyvinyl alcohol particles mixed with ketoprofen versus bland polyvinyl alcohol particles","Pisco JM, Bilhim T, Duarte M, Ferreira A, Santos D, Pires FM, Oliveira AG.","J Vasc Interv Radiol. 2008 Nov;19(11):1537-42. doi: 10.1016/j.jvir.2008.07.015. Epub 2008 Sep 25.","Pisco JM","J Vasc Interv Radiol","2008","2008/09/27","","","10.1016/j.jvir.2008.07.015"
"30772385","Safety of lixisenatide versus sulfonylurea added to basal insulin treatment in people with type 2 diabetes mellitus who elect to fast during Ramadan (LixiRam): An international, randomized, open-label trial","Hassanein MM, Sahay R, Hafidh K, Djaballah K, Li H, Azar S, Shehadeh N, Hanif W.","Diabetes Res Clin Pract. 2019 Apr;150:331-341. doi: 10.1016/j.diabres.2019.01.035. Epub 2019 Feb 14.","Hassanein MM","Diabetes Res Clin Pract","2019","2019/02/18","","","10.1016/j.diabres.2019.01.035"
"31586060","Meta-analysis of randomised controlled trials testing behavioural interventions to promote household action on climate change","Nisa CF, Bélanger JJ, Schumpe BM, Faller DG.","Nat Commun. 2019 Oct 4;10(1):4545. doi: 10.1038/s41467-019-12457-2.","Nisa CF","Nat Commun","2019","2019/10/06","PMC6778105","","10.1038/s41467-019-12457-2"
"22476230","Is home blood pressure variability itself an interventional target beyond lowering mean home blood pressure during anti-hypertensive treatment?","Hoshide S, Yano Y, Shimizu M, Eguchi K, Ishikawa J, Kario K.","Hypertens Res. 2012 Aug;35(8):862-6. doi: 10.1038/hr.2012.46. Epub 2012 Apr 5.","Hoshide S","Hypertens Res","2012","2012/04/06","","","10.1038/hr.2012.46"
"15297583","Recovery after uterine artery embolization for leiomyomas: a detailed analysis of its duration and severity","Bruno J, Sterbis K, Flick P, McCullough M, Cramp M, Murphy-Skrynarz K, Spies JB.","J Vasc Interv Radiol. 2004 Aug;15(8):801-7. doi: 10.1097/01.RVI.0000136983.45640.E4.","Bruno J","J Vasc Interv Radiol","2004","2004/08/07","","","10.1097/01.RVI.0000136983.45640.E4"
"30663129","Influence of patient-reported outcomes on the treatment effect of deferasirox film-coated and dispersible tablet formulations in the ECLIPSE trial: A post hoc mediation analysis","Taher AT, Origa R, Perrotta S, Kouraklis A, Belhoul K, Huang V, Han J, Bruederle A, Bobbili P, Duh MS, Porter JB.","Am J Hematol. 2019 Apr;94(4):E96-E99. doi: 10.1002/ajh.25408. Epub 2019 Jan 31.","Taher AT","Am J Hematol","2019","2019/01/22","PMC6590223","","10.1002/ajh.25408"
"27498606","Long-Term Effects of Repeated Prefrontal Cortex Transcranial Direct Current Stimulation (tDCS) on Food Craving in Normal and Overweight Young Adults","Ljubisavljevic M, Maxood K, Bjekic J, Oommen J, Nagelkerke N.","Brain Stimul. 2016 Nov-Dec;9(6):826-833. doi: 10.1016/j.brs.2016.07.002. Epub 2016 Jul 15.","Ljubisavljevic M","Brain Stimul","2016","2016/08/09","","","10.1016/j.brs.2016.07.002"
"17719935","Nebulized hypertonic saline in the treatment of viral bronchiolitis in infants","Kuzik BA, Al-Qadhi SA, Kent S, Flavin MP, Hopman W, Hotte S, Gander S.","J Pediatr. 2007 Sep;151(3):266-70, 270.e1. doi: 10.1016/j.jpeds.2007.04.010. Epub 2007 Jun 29.","Kuzik BA","J Pediatr","2007","2007/08/28","","","10.1016/j.jpeds.2007.04.010"
"24916651","Effect of epidural methylprednisolone on post-operative pain and length of hospital stay in patients undergoing lumbar microdiscectomy","Aljabi Y, El-Shawarby A, Cawley DT, Aherne T.","Surgeon. 2015 Oct;13(5):245-9. doi: 10.1016/j.surge.2014.03.012. Epub 2014 Jun 7.","Aljabi Y","Surgeon","2015","2014/06/12","","","10.1016/j.surge.2014.03.012"
"27102319","Comparison of residual salivary fluoride retention using amine fluoride toothpastes in caries-free and caries-prone children","Nazzal H, Duggal MS, Kowash MB, Kang J, Toumba KJ.","Eur Arch Paediatr Dent. 2016 Jun;17(3):165-9. doi: 10.1007/s40368-015-0220-x. Epub 2016 Apr 21.","Nazzal H","Eur Arch Paediatr Dent","2016","2016/04/23","PMC4882375","","10.1007/s40368-015-0220-x"
"10652036","Long-term effects of angiotensin-converting enzyme inhibition and metabolic control in hypertensive type 2 diabetic patients","Chan JC, Ko GT, Leung DH, Cheung RC, Cheung MY, So WY, Swaminathan R, Nicholls MG, Critchley JA, Cockram CS.","Kidney Int. 2000 Feb;57(2):590-600. doi: 10.1046/j.1523-1755.2000.00879.x.","Chan JC","Kidney Int","2000","2000/01/29","","","10.1046/j.1523-1755.2000.00879.x"
"27665525","Standard triple therapy versus sequential therapy for eradication of Helicobacter pylori in treatment naïve and retreat patients","Abuhammour A, Dajani A, Nounou M, Zakaria M.","Arab J Gastroenterol. 2016 Sep;17(3):131-136. doi: 10.1016/j.ajg.2016.07.001. Epub 2016 Sep 21.","Abuhammour A","Arab J Gastroenterol","2016","2016/09/26","","","10.1016/j.ajg.2016.07.001"
"11131273","Effects of lisinopril and nitrendipine on urinary albumin excretion and renal function in patients with mild to moderate essential hypertension","Ogawa Y, Haneda T, Hirayama T, Ide H, Obara A, Maruyama J, Morimoto H, Tanaka H, Kato J, Hayakawa T, Hasebe N, Kikuchi K.","Hypertens Res. 2000 Nov;23(6):607-12. doi: 10.1291/hypres.23.607.","Ogawa Y","Hypertens Res","2000","2000/12/29","","","10.1291/hypres.23.607"
"16075412","Bioequivalence evaluation of two brands of lisinopril tablets (Lisotec and Zestril) in healthy human volunteers","Tamimi JJ, Salem II, Alam SM, Zaman Q, Dham R.","Biopharm Drug Dispos. 2005 Nov;26(8):335-9. doi: 10.1002/bdd.465.","Tamimi JJ","Biopharm Drug Dispos","2005","2005/08/03","","","10.1002/bdd.465"
"12737240","Comparing the efficacy of mandibular implant-retained overdentures and conventional dentures among middle-aged edentulous patients: satisfaction and functional assessment","Awad MA, Lund JP, Dufresne E, Feine JS.","Int J Prosthodont. 2003 Mar-Apr;16(2):117-22.","Awad MA","Int J Prosthodont","2003","2003/05/10","","",""
"25742794","Comparison of anesthetic efficacy between lidocaine with and without magnesium sulfate USP 50% for inferior alveolar nerve blocks in patients with symptomatic irreversible pulpitis","Shetty KP, Satish SV, Kilaru KR, Sardar P, Luke AM.","J Endod. 2015 Apr;41(4):431-3. doi: 10.1016/j.joen.2015.01.003. Epub 2015 Mar 2.","Shetty KP","J Endod","2015","2015/03/07","","","10.1016/j.joen.2015.01.003"
"15297582","Polyvinyl alcohol particles and tris-acryl gelatin microspheres for uterine artery embolization for leiomyomas: results of a randomized comparative study","Spies JB, Allison S, Flick P, McCullough M, Sterbis K, Cramp M, Bruno J, Jha R.","J Vasc Interv Radiol. 2004 Aug;15(8):793-800. doi: 10.1097/01.RVI.0000136982.42548.5D.","Spies JB","J Vasc Interv Radiol","2004","2004/08/07","","","10.1097/01.RVI.0000136982.42548.5D"
"18205096","Plasma matrix metalloproteinase-9 and ACE-inhibitor-induced improvement of urinary albumin excretion in non-diabetic, microalbuminuric subjects","van de Wal RM, van der Harst P, Gerritsen WB, van der Horst F, Plokker TH, Gansevoort RT, van Gilst WH, Voors AA.","J Renin Angiotensin Aldosterone Syst. 2007 Dec;8(4):177-80. doi: 10.3317/jraas.2007.029.","van de Wal RM","J Renin Angiotensin Aldosterone Syst","2007","2008/01/22","","","10.3317/jraas.2007.029"
"11180196","Bioequivalence evaluation of norfloxacin 400 mg tablets (Uroxin and Noroxin) in healthy human volunteers","Al-Rashood K, Al-Khamis K, El-Sayed Y, Al-Bella S, Al-Yamani M, Alam S, Dham R.","Biopharm Drug Dispos. 2000 Jul;21(5):175-9. doi: 10.1002/1099-081x(200007)21:5<175::aid-bdd228>3.0.co;2-5.","Al-Rashood K","Biopharm Drug Dispos","2000","2001/02/17","","","10.1002/1099-081x(200007)21:5<175::aid-bdd228>3.0.co;2-5"
"15194014","Comparison of rapidity of coronary recanalization in men with tenecteplase versus alteplase in acute myocardial infarction","Binbrek AS, Rao NS, Neimane D, Hatou E, Abdulali S, Sobel BE.","Am J Cardiol. 2004 Jun 15;93(12):1465-8. doi: 10.1016/j.amjcard.2004.03.004.","Binbrek AS","Am J Cardiol","2004","2004/06/15","","","10.1016/j.amjcard.2004.03.004"
"12784317","Pharmacokinetics and bioequivalence evaluation of two simvastatin 40 mg tablets (Simvast and Zocor) in healthy human volunteers","Najib NM, Idkaidek N, Adel A, Admour I, Astigarraga RE, Nucci GD, Alam SM, Dham R, Qumaruzaman.","Biopharm Drug Dispos. 2003 Jul;24(5):183-9. doi: 10.1002/bdd.347.","Najib NM","Biopharm Drug Dispos","2003","2003/06/05","","","10.1002/bdd.347"
"24703280","Effect of intraoral aging on the setting status of resin composite and glass ionomer orthodontic adhesives","Iliadi A, Baumgartner S, Athanasiou AE, Eliades T, Eliades G.","Am J Orthod Dentofacial Orthop. 2014 Apr;145(4):425-33. doi: 10.1016/j.ajodo.2013.11.020.","Iliadi A","Am J Orthod Dentofacial Orthop","2014","2014/04/08","","","10.1016/j.ajodo.2013.11.020"
"19801020","Erythropoietin to augment myocardial salvage induced by coronary thrombolysis in patients with ST segment elevation acute myocardial infarction","Binbrek AS, Rao NS, Al Khaja N, Assaqqaf J, Sobel BE.","Am J Cardiol. 2009 Oct 15;104(8):1035-40. doi: 10.1016/j.amjcard.2009.05.050.","Binbrek AS","Am J Cardiol","2009","2009/10/06","","","10.1016/j.amjcard.2009.05.050"
"12056535","Bioequivalence of two brands of ciprofloxacin 750 mg tablets (Sarf and Ciprobay) in healthy human volunteers","Abdallah RM, Alam SM, Awaad FM, Dham R, El-Kersh A, El-Laithy A, Shalby MH, Shihabeddin M, El-Walily AF, Yacout M, Zaman Q.","Drug Dev Ind Pharm. 2002 Apr;28(4):423-9. doi: 10.1081/ddc-120003003.","Abdallah RM","Drug Dev Ind Pharm","2002","2002/06/12","","","10.1081/ddc-120003003"
"24694553","Three-dimensional navigation is more accurate than two-dimensional navigation or conventional fluoroscopy for percutaneous sacroiliac screw fixation in the dysmorphic sacrum: a randomized multicenter study","Matityahu A, Kahler D, Krettek C, Stöckle U, Grutzner PA, Messmer P, Ljungqvist J, Gebhard F.","J Orthop Trauma. 2014 Dec;28(12):707-10. doi: 10.1097/BOT.0000000000000092.","Matityahu A","J Orthop Trauma","2014","2014/04/04","","","10.1097/BOT.0000000000000092"
"11353877","Early ACE-i intervention in microalbuminuric patients with type 1 diabetes: effects on albumin excretion, 24 h ambulatory blood pressure, and renal function","Poulsen PL, Ebbehøj E, Nosadini R, Fioretto P, Deferrari G, Crepaldi G, Mogensen CE.","Diabetes Metab. 2001 Apr;27(2 Pt 1):123-8.","Poulsen PL","Diabetes Metab","2001","2001/05/17","","",""
"16319148","Spherical polyvinyl alcohol versus tris-acryl gelatin microspheres for uterine artery embolization for leiomyomas: results of a limited randomized comparative study","Spies JB, Allison S, Flick P, Cramp M, Bruno J, Jha RC, Ascher SA.","J Vasc Interv Radiol. 2005 Nov;16(11):1431-7. doi: 10.1097/01.RVI.0000179793.69590.1A.","Spies JB","J Vasc Interv Radiol","2005","2005/12/02","","","10.1097/01.RVI.0000179793.69590.1A"
"11226823","Bioequivalence evaluation of lansoprazole 30-mg capsules (Lanfast and Lanzor) in healthy volunteers","Dugger HA, Carlson JD, Henderson W, Erdmann GR, Alam SM, Dham R, Quamruzaman.","Eur J Pharm Biopharm. 2001 Mar;51(2):153-7. doi: 10.1016/s0939-6411(00)00152-1.","Dugger HA","Eur J Pharm Biopharm","2001","2001/02/28","","","10.1016/s0939-6411(00)00152-1"
"11686543","Effects of low-dose losartan treatment on persistent microalbuminuria in normotensive type 1 diabetic subjects","Açbay O.","J Endocrinol Invest. 2001 Sep;24(8):608-11. doi: 10.1007/BF03343901.","Açbay O","J Endocrinol Invest","2001","2001/11/01","","","10.1007/BF03343901"
"12355581","Bioequivalence evaluation of two brands of metformin 500 mg tablets (Dialon & Glucophage)--in healthy human volunteers","Najib N, Idkaidek N, Beshtawi M, Bader M, Admour I, Alam SM, Zaman Q, Dham R.","Biopharm Drug Dispos. 2002 Oct;23(7):301-6. doi: 10.1002/bdd.326.","Najib N","Biopharm Drug Dispos","2002","2002/10/02","","","10.1002/bdd.326"
"12577391","[Effect of Acanthopanax senticosus injection on plasma and urinary endothelin in early stage of diabetic nephropathy]","Ni HX, Luo SS, Shao GM.","Zhongguo Zhong Xi Yi Jie He Za Zhi. 2001 Feb;21(2):105-7.","Ni HX","Zhongguo Zhong Xi Yi Jie He Za Zhi","2001","2003/02/13","","",""
"12973821","Bioequivalence evaluation of two brands of furosemide 40 mg tablets (Salurin and Lasix) in healthy human volunteers","Najib N, Idkaidek N, Beshtawi M, Bader M, Admour I, Alam SM, Zaman Q, Dham R.","Biopharm Drug Dispos. 2003 Sep;24(6):245-9. doi: 10.1002/bdd.361.","Najib N","Biopharm Drug Dispos","2003","2003/09/16","","","10.1002/bdd.361"
"23680708","Do probiotics improve eradication response to Helicobacter pylori on standard triple or sequential therapy?","Dajani AI, Abu Hammour AM, Yang DH, Chung PC, Nounou MA, Yuan KY, Zakaria MA, Schi HS.","Saudi J Gastroenterol. 2013 May-Jun;19(3):113-20. doi: 10.4103/1319-3767.111953.","Dajani AI","Saudi J Gastroenterol","2013","2013/05/18","PMC3709373","","10.4103/1319-3767.111953"
"15083498","Bioequivalence evaluation of two brands of aceclofenac 100 mg tablets (Aceclofar and Bristaflam) in healthy human volunteers","Najib N, Idkaidek N, Beshtawi M, Bader M, Admour I, Alam SM, Zaman Q, Dham R.","Biopharm Drug Dispos. 2004 Apr;25(3):103-8. doi: 10.1002/bdd.388.","Najib N","Biopharm Drug Dispos","2004","2004/04/15","","","10.1002/bdd.388"
"24992091","A call to honesty: extending religious priming of moral behavior to Middle Eastern Muslims","Aveyard ME.","PLoS One. 2014 Jul 3;9(7):e99447. doi: 10.1371/journal.pone.0099447. eCollection 2014.","Aveyard ME","PLoS One","2014","2014/07/04","PMC4084630","","10.1371/journal.pone.0099447"
"14739907","LIFE and SCOPE: what guidance do they offer alongside ALLHAT and ANBP2?","Nicholls MG.","J Hum Hypertens. 2004 May;18(5):295-300. doi: 10.1038/sj.jhh.1001675.","Nicholls MG","J Hum Hypertens","2004","2004/01/24","","","10.1038/sj.jhh.1001675"
"24277919","Assessment of seroconversion to a peste des petits ruminants virus live vaccine in Arabian oryx (Oryx leucoryx)","Sa RC, Bailey TA, O'Donovan D, Wernery U, Kilgallon CP.","Vet Rec. 2013 Dec 21;173(24):609. doi: 10.1136/vr.101883. Epub 2013 Nov 25.","Sa RC","Vet Rec","2013","2013/11/27","","","10.1136/vr.101883"
"12551705","Comparison of two cyclosporine formulations in healthy Middle Eastern volunteers: bioequivalence of the new Sigmasporin Microoral and Sandimmun Neoral","Najib NM, Idkaidek N, Adel A, Mohammed B, Al-Masri S, Admour I, Alam SM, Dham R, Qumaruzaman.","Eur J Pharm Biopharm. 2003 Jan;55(1):67-70. doi: 10.1016/s0939-6411(02)00157-1.","Najib NM","Eur J Pharm Biopharm","2003","2003/01/29","","","10.1016/s0939-6411(02)00157-1"
"28300320","Improvement in moderate to severe vitiligo using a novel combination of 308 nm excimer laser and a surgical needling technique","BinSheikhan S, Al Abadie M.","Clin Exp Dermatol. 2017 Apr;42(3):363-366. doi: 10.1111/ced.13056.","BinSheikhan S","Clin Exp Dermatol","2017","2017/03/17","","","10.1111/ced.13056"
"14511878","Vaginal misoprostol versus dinoprostone for the management of missed abortion","Al Inizi SA, Ezimokhai M.","Int J Gynaecol Obstet. 2003 Oct;83(1):73-4. doi: 10.1016/s0020-7292(03)00199-1.","Al Inizi SA","Int J Gynaecol Obstet","2003","2003/09/27","","","10.1016/s0020-7292(03)00199-1"
"15099781","Glyceryl trinitrate vs. ritodrine for the treatment of preterm labor","Wani MP, Barakzai N, Graham I.","Int J Gynaecol Obstet. 2004 May;85(2):165-7. doi: 10.1016/j.ijgo.2003.09.001.","Wani MP","Int J Gynaecol Obstet","2004","2004/04/22","","","10.1016/j.ijgo.2003.09.001"
"10895410","The relative rapidity of recanalization induced by recombinant tissue-type plasminogen activator (r-tPA) and TNK-tPA, assessed with enzymatic methods","Binbrek A, Rao N, Absher PM, Van de Werf F, Sobel BE.","Coron Artery Dis. 2000 Jul;11(5):429-35. doi: 10.1097/00019501-200007000-00008.","Binbrek A","Coron Artery Dis","2000","2000/07/15","","","10.1097/00019501-200007000-00008"
"33936897","Clearing the Fog: Is Hydroxychloroquine Effective in Reducing Coronavirus Disease-2019 Progression? A Randomized Controlled Trial","Kamran SM, Moeed HA, Mirza ZE, Naseem A, Azam R, Ullah N, Saeed F, Alamgir W, Saleem S, Nisar S.","Cureus. 2021 Mar 30;13(3):e14186. doi: 10.7759/cureus.14186.","Kamran SM","Cureus","2021","2021/05/03","PMC8083993","","10.7759/cureus.14186"
"28295959","The albuminuria-lowering response to dapagliflozin is variable and reproducible among individual patients","Petrykiv SI, Laverman GD, de Zeeuw D, Heerspink HJL.","Diabetes Obes Metab. 2017 Oct;19(10):1363-1370. doi: 10.1111/dom.12936. Epub 2017 Jun 8.","Petrykiv SI","Diabetes Obes Metab","2017","2017/03/16","","","10.1111/dom.12936"
"22112682","A crossover comparison of urinary albumin excretion as a new surrogate marker for cardiovascular disease among 4 types of calcium channel blockers","Konoshita T, Makino Y, Kimura T, Fujii M, Morikawa N, Wakahara S, Arakawa K, Inoki I, Nakamura H, Miyamori I; Genomic Disease Outcome Consortium (G-DOC) Study Investigators.","Int J Cardiol. 2013 Jun 20;166(2):448-52. doi: 10.1016/j.ijcard.2011.10.133. Epub 2011 Nov 21.","Konoshita T","Int J Cardiol","2013","2011/11/25","","","10.1016/j.ijcard.2011.10.133"
"11799261","Effect of cerivastatin on urinary albumin excretion and plasma endothelin-1 concentrations in type 2 diabetes patients with microalbuminuria and dyslipidemia","Nakamura T, Ushiyama C, Hirokawa K, Osada S, Shimada N, Koide H.","Am J Nephrol. 2001 Nov-Dec;21(6):449-54. doi: 10.1159/000046648.","Nakamura T","Am J Nephrol","2001","2002/01/19","","","10.1159/000046648"
"28744992","The effect of 12 weeks carnosine supplementation on renal functional integrity and oxidative stress in pediatric patients with diabetic nephropathy: a randomized placebo-controlled trial","Elbarbary NS, Ismail EAR, El-Naggar AR, Hamouda MH, El-Hamamsy M.","Pediatr Diabetes. 2018 May;19(3):470-477. doi: 10.1111/pedi.12564. Epub 2017 Jul 26.","Elbarbary NS","Pediatr Diabetes","2018","2017/07/27","","","10.1111/pedi.12564"
"27884686","Intraarterial Lidocaine for Pain Control in Uterine Artery Embolization: A Prospective, Randomized Study","Noel-Lamy M, Tan KT, Simons ME, Sniderman KW, Mironov O, Rajan DK.","J Vasc Interv Radiol. 2017 Jan;28(1):16-22. doi: 10.1016/j.jvir.2016.10.001. Epub 2016 Nov 22.","Noel-Lamy M","J Vasc Interv Radiol","2017","2016/11/26","","","10.1016/j.jvir.2016.10.001"
"15968712","Bioequivalence evaluation of two brands of fluoxetine 20 mg capsules (Flutin and Prozac) in healthy human volunteers","Najib NM, Idkaidek N, Beshtawi M, Mohammed B, Admour I, Alam SM, Dham R, Qumaruzaman.","Biopharm Drug Dispos. 2005 Sep;26(6):243-7. doi: 10.1002/bdd.456.","Najib NM","Biopharm Drug Dispos","2005","2005/06/22","","","10.1002/bdd.456"
"20399113","Bilateral versus unilateral femoral access for uterine artery embolization: results of a randomized comparative trial","Costantino M, Lee J, McCullough M, Nsouli-Maktabi H, Spies JB.","J Vasc Interv Radiol. 2010 Jun;21(6):829-35; quiz 835. doi: 10.1016/j.jvir.2010.01.042. Epub 2010 Apr 15.","Costantino M","J Vasc Interv Radiol","2010","2010/04/20","","","10.1016/j.jvir.2010.01.042"
"12460699","Effects of amlodipine fosinopril combination on microalbuminuria in hypertensive type 2 diabetic patients","Fogari R, Preti P, Zoppi A, Rinaldi A, Corradi L, Pasotti C, Poletti L, Marasi G, Derosa G, Mugellini A, Voglini C, Lazzari P.","Am J Hypertens. 2002 Dec;15(12):1042-9. doi: 10.1016/s0895-7061(02)03017-0.","Fogari R","Am J Hypertens","2002","2002/12/04","","","10.1016/s0895-7061(02)03017-0"
