PMID,Title,Authors,Citation,First Author,Journal/Book,Publication Year,Create Date,PMCID,NIHMS ID,DOI
"28903598","Healthcare providers' attitude and knowledge regarding medication use in breastfeeding women: a Jordanian national questionnaire study","Al-Sawalha NA, Sawalha A, Tahaineh L, Almomani B, Al-Keilani M.","J Obstet Gynaecol. 2018 Feb;38(2):217-221. doi: 10.1080/01443615.2017.1345876. Epub 2017 Sep 14.","Al-Sawalha NA","J Obstet Gynaecol","2018","2017/09/15","","","10.1080/01443615.2017.1345876"
"25415630","Socio-demographic and dietary factors associated with obesity among female university students in Jordan","Musaiger AO, Hammad SS, Tayyem RF, Qatatsheh AA.","Int J Adolesc Med Health. 2015 Aug;27(3):299-305. doi: 10.1515/ijamh-2014-0029.","Musaiger AO","Int J Adolesc Med Health","2015","2014/11/22","","","10.1515/ijamh-2014-0029"
"28502638","Oncology nurses' knowledge of guidelines for preventing catheter-related bloodstream infections","Al Qadire M.","Am J Infect Control. 2017 Sep 1;45(9):e95-e97. doi: 10.1016/j.ajic.2017.03.034. Epub 2017 May 11.","Al Qadire M","Am J Infect Control","2017","2017/05/16","","","10.1016/j.ajic.2017.03.034"
"11569662","Reasons for placement and replacement of amalgam restorations in Jordan","Al Negrish AR.","Int Dent J. 2001 Apr;51(2):109-15. doi: 10.1002/j.1875-595x.2001.tb00831.x.","Al Negrish AR","Int Dent J","2001","2001/09/25","","","10.1002/j.1875-595x.2001.tb00831.x"
"30507761","Evaluating health warning messages specific to waterpipe smoking among university students in Jordan","Darawad MW, Salloum R, Alhussami M, Maharmeh M.","J Am Assoc Nurse Pract. 2019 Feb;31(2):133-138. doi: 10.1097/JXX.0000000000000107.","Darawad MW","J Am Assoc Nurse Pract","2019","2018/12/04","","","10.1097/JXX.0000000000000107"
"30145152","Extended-spectrum β-lactamase producing E. coli in urinary tract infections: A two-center, cross-sectional study of prevalence, genotypes and risk factors in Amman, Jordan","Al-Jamei SA, Albsoul AY, Bakri FG, Al-Bakri AG.","J Infect Public Health. 2019 Jan-Feb;12(1):21-25. doi: 10.1016/j.jiph.2018.07.011. Epub 2018 Aug 23.","Al-Jamei SA","J Infect Public Health","2019","2018/08/27","","","10.1016/j.jiph.2018.07.011"
"28602473","Mothers' knowledge & perception about child sexual abuse in Jordan","Alzoubi FA, Ali RA, Flah IH, Alnatour A.","Child Abuse Negl. 2018 Jan;75:149-158. doi: 10.1016/j.chiabu.2017.06.006. Epub 2017 Jun 9.","Alzoubi FA","Child Abuse Negl","2018","2017/06/13","","","10.1016/j.chiabu.2017.06.006"
"12464507","Socio-demographic characteristics of adolescents with epilepsy in Northern Jordan","Hussein MJ, El-Qaderi S.","Seizure. 2002 Dec;11(8):483-8. doi: 10.1016/s1059-1311(02)00133-4.","Hussein MJ","Seizure","2002","2002/12/05","","","10.1016/s1059-1311(02)00133-4"
"20714685","Association of parental history of type 2 diabetes mellitus with leptin levels in Jordanian male youths","Abu-Hasheesh MO, Abu-Samak MS, Al-Matubsi HY, Jaradeh MS, Jarrah SS, Khuzaie RF.","Saudi Med J. 2010 Aug;31(8):882-6.","Abu-Hasheesh MO","Saudi Med J","2010","2010/08/18","","",""
"16380681","Kerosene poisoning in childhood: a 6-year prospective study at the Princess Rahmat Teaching Hospital","Shotar AM.","Neuro Endocrinol Lett. 2005 Dec;26(6):835-8.","Shotar AM","Neuro Endocrinol Lett","2005","2005/12/29","","",""
"21118291","Family strategies for managing childhood cancer: using complementary and alternative medicine in Jordan","Al-Qudimat MR, Rozmus CL, Farhan N.","J Adv Nurs. 2011 Mar;67(3):591-7. doi: 10.1111/j.1365-2648.2010.05517.x. Epub 2010 Nov 30.","Al-Qudimat MR","J Adv Nurs","2011","2010/12/02","","","10.1111/j.1365-2648.2010.05517.x"
"29587135","Clinical duration of eruption of deciduous teeth in Jordanian children: A cross-sectional study","Al-Batayneh OB, Shaweesh A.","Arch Oral Biol. 2018 Jun;90:86-90. doi: 10.1016/j.archoralbio.2018.03.005. Epub 2018 Mar 21.","Al-Batayneh OB","Arch Oral Biol","2018","2018/03/28","","","10.1016/j.archoralbio.2018.03.005"
"12013256","Caries in preschool children in Amman, Jordan and the relationship to socio-demographic factors","Sayegh A, Dini EL, Holt RD, Bedi R.","Int Dent J. 2002 Apr;52(2):87-93. doi: 10.1111/j.1875-595x.2002.tb00606.x.","Sayegh A","Int Dent J","2002","2002/05/16","","","10.1111/j.1875-595x.2002.tb00606.x"
"30729536","Psychological distress and perceived burden in caregivers of persons with autism spectrum disorder","Alnazly EK, Abojedi A.","Perspect Psychiatr Care. 2019 Jul;55(3):501-508. doi: 10.1111/ppc.12356. Epub 2019 Feb 6.","Alnazly EK","Perspect Psychiatr Care","2019","2019/02/08","","","10.1111/ppc.12356"
"22077750","Knowledge and attitudes of Jordanian nurses towards patients with HIV/AIDS: findings from a nationwide survey","Hassan ZM, Wahsheh MA.","Issues Ment Health Nurs. 2011;32(12):774-84. doi: 10.3109/01612840.2011.610562.","Hassan ZM","Issues Ment Health Nurs","2011","2011/11/15","","","10.3109/01612840.2011.610562"
"31989770","Examining the associations between smartphone use and mother-infant bonding and family functioning: A survey design","Ali RA, Alnuaimi KM, Al-Jarrah IA.","Nurs Health Sci. 2020 Jun;22(2):235-242. doi: 10.1111/nhs.12684. Epub 2020 Jan 27.","Ali RA","Nurs Health Sci","2020","2020/01/29","","","10.1111/nhs.12684"
"18786846","Childhood brucellosis in Jordan: prevalence and analysis of risk factors","Al-Majali AM, Shorman M.","Int J Infect Dis. 2009 Mar;13(2):196-200. doi: 10.1016/j.ijid.2008.06.012. Epub 2008 Sep 10.","Al-Majali AM","Int J Infect Dis","2009","2008/09/13","","","10.1016/j.ijid.2008.06.012"
"17909674","Body composition, nutrient intake and physical activity patterns in young women during Ramadan","Al-Hourani HM, Atoum MF.","Singapore Med J. 2007 Oct;48(10):906-10.","Al-Hourani HM","Singapore Med J","2007","2007/10/03","","",""
"34972196","E-cigarettes use among university students in Jordan: Perception and related knowledge","Al-Sawalha NA, Almomani BA, Mokhemer E, Al-Shatnawi SF, Bdeir R.","PLoS One. 2021 Dec 31;16(12):e0262090. doi: 10.1371/journal.pone.0262090. eCollection 2021.","Al-Sawalha NA","PLoS One","2021","2021/12/31","PMC8719738","","10.1371/journal.pone.0262090"
"27015937","Adherence in outpatients taking warfarin and its effect on anticoagulation control in Jordan","Ababneh MA, Al-Azzam SI, Alzoubi KH, Rababa'h AM.","Int J Clin Pharm. 2016 Aug;38(4):816-21. doi: 10.1007/s11096-016-0282-9. Epub 2016 Mar 25.","Ababneh MA","Int J Clin Pharm","2016","2016/03/27","","","10.1007/s11096-016-0282-9"
"31834888","Assessing insomnia management in community pharmacy setting in Jordan: A simulated patient approach","Wazaify M, Elayeh E, Tubeileh R, Hammad EA.","PLoS One. 2019 Dec 13;14(12):e0226076. doi: 10.1371/journal.pone.0226076. eCollection 2019.","Wazaify M","PLoS One","2019","2019/12/14","PMC6910704","","10.1371/journal.pone.0226076"
"17037714","Prevalence and risk indicators of myopia among schoolchildren in Amman, Jordan","Khader YS, Batayha WQ, Abdul-Aziz SM, Al-Shiekh-Khalil MI.","East Mediterr Health J. 2006 May-Jul;12(3-4):434-9.","Khader YS","East Mediterr Health J","2006","2006/10/14","","",""
"20701820","Young urban women and the nutrition transition in Jordan","Madanat HN, Lindsay R, Campbell T.","Public Health Nutr. 2011 Apr;14(4):599-604. doi: 10.1017/S1368980010002107. Epub 2010 Aug 12.","Madanat HN","Public Health Nutr","2011","2010/08/13","","","10.1017/S1368980010002107"
"22204246","Hospital-based study on the use of herbal medicine in patients with coronary artery disease in Jordan","Omeish AF, Abbadi W, Ghanma IM, Drabaa Z, Botoosh FA, Seif A, Massadeh M.","J Pak Med Assoc. 2011 Jul;61(7):683-7.","Omeish AF","J Pak Med Assoc","2011","2011/12/30","","",""
"29077201","Mental health nurses' perspective of workplace violence in Jordanian mental health hospitals","Al-Azzam M, Al-Sagarat AY, Tawalbeh L, Poedel RJ.","Perspect Psychiatr Care. 2018 Oct;54(4):477-487. doi: 10.1111/ppc.12250. Epub 2017 Oct 27.","Al-Azzam M","Perspect Psychiatr Care","2018","2017/10/28","","","10.1111/ppc.12250"
"25081724","Quality of life and psychological well-being of breast cancer survivors in Jordan","Abu-Helalah M, Al-Hanaqta M, Alshraideh H, Abdulbaqi N, Hijazeen J.","Asian Pac J Cancer Prev. 2014;15(14):5927-36. doi: 10.7314/apjcp.2014.15.14.5927.","Abu-Helalah M","Asian Pac J Cancer Prev","2014","2014/08/02","","","10.7314/apjcp.2014.15.14.5927"
"22838940","Parental stress when caring for a child with cancer in Jordan: a cross-sectional survey","Masa'Deh R, Collier J, Hall C.","Health Qual Life Outcomes. 2012 Jul 28;10:88. doi: 10.1186/1477-7525-10-88.","Masa'Deh R","Health Qual Life Outcomes","2012","2012/07/31","PMC3416682","","10.1186/1477-7525-10-88"
"31078669","The prevalence of high risk obstructive sleep apnoea among patients with type 2 diabetes in Jordan","Saad AMJ, Hiyasat D, Jaddou H, Obeidat N.","Diabetes Res Clin Pract. 2019 Jun;152:16-22. doi: 10.1016/j.diabres.2019.04.035. Epub 2019 May 9.","Saad AMJ","Diabetes Res Clin Pract","2019","2019/05/13","","","10.1016/j.diabres.2019.04.035"
"19910269","Body image dissatisfaction among adolescent schoolgirls in Jordan","Mousa TY, Mashal RH, Al-Domi HA, Jibril MA.","Body Image. 2010 Jan;7(1):46-50. doi: 10.1016/j.bodyim.2009.10.002. Epub 2009 Nov 12.","Mousa TY","Body Image","2010","2009/11/14","","","10.1016/j.bodyim.2009.10.002"
"28133689","Diabetes mellitus in two genetically distinct populations in Jordan. A Comparison between Arabs and Circassians/Chechens Living with Diabetes","Al-Eitan LN, Nassar AM, Dajani RB, Almomani BA, Saadeh NA.","Saudi Med J. 2017 Feb;38(2):163-169. doi: 10.15537/smj.2017.2.17910.","Al-Eitan LN","Saudi Med J","2017","2017/01/31","PMC5329628","","10.15537/smj.2017.2.17910"
"25990460","Impact of Spiritual Well-Being, Spiritual Perspective, and Religiosity on the Self-Rated Health of Jordanian Arab Christians","Musa AS, Pevalin DJ, Shahin FI.","J Transcult Nurs. 2016 Nov;27(6):550-557. doi: 10.1177/1043659615587590. Epub 2015 May 19.","Musa AS","J Transcult Nurs","2016","2015/05/21","","","10.1177/1043659615587590"
"24328913","Effect of socioeconomic status on normative and perceived orthodontic treatment need","Badran SA, Sabrah AH, Hadidi SA, Al-Khateeb S.","Angle Orthod. 2014 Jul;84(4):588-93. doi: 10.2319/062913-482.1. Epub 2013 Dec 16.","Badran SA","Angle Orthod","2014","2013/12/17","PMC8650454","","10.2319/062913-482.1"
"31023117","Evaluation of Jordanian Healthcare Providers' Knowledge, Attitudes, and Practice Patterns towards Probiotics","Ababneh M, Elrashed N, Al-Azayzih A.","Expert Rev Pharmacoecon Outcomes Res. 2020 Feb;20(1):93-97. doi: 10.1080/14737167.2019.1609354. Epub 2019 Apr 26.","Ababneh M","Expert Rev Pharmacoecon Outcomes Res","2020","2019/04/27","","","10.1080/14737167.2019.1609354"
"25432254","Impact of bullying due to dentofacial features on oral health-related quality of life","Al-Omari IK, Al-Bitar ZB, Sonbol HN, Al-Ahmad HT, Cunningham SJ, Al-Omiri M.","Am J Orthod Dentofacial Orthop. 2014 Dec;146(6):734-9. doi: 10.1016/j.ajodo.2014.08.011.","Al-Omari IK","Am J Orthod Dentofacial Orthop","2014","2014/11/30","","","10.1016/j.ajodo.2014.08.011"
"30606043","Physicians' standpoints on end-of-life decisions at the neonatal intensive care units in Jordan","Abdel Razeq NM.","J Child Health Care. 2019 Dec;23(4):579-595. doi: 10.1177/1367493518814926. Epub 2019 Jan 3.","Abdel Razeq NM","J Child Health Care","2019","2019/01/05","","","10.1177/1367493518814926"
"31220967","Knowledge, Awareness, and Compliance of Disease Surveillance and Notification Among Jordanian Physicians in Residency Programs","Abdulrahim N, Alasasfeh I, Khader YS, Iblan I.","Inquiry. 2019 Jan-Dec;56:46958019856508. doi: 10.1177/0046958019856508.","Abdulrahim N","Inquiry","2019","2019/06/22","PMC6589958","","10.1177/0046958019856508"
"33307895","Prevalence of antimicrobial use in a tertiary academic hospital: a venue for antimicrobial stewardship programs","Ababneh MA, Jaber M, Rababa'h A, Alabweny E.","Expert Rev Anti Infect Ther. 2021 Aug;19(8):1047-1051. doi: 10.1080/14787210.2021.1863789. Epub 2020 Dec 21.","Ababneh MA","Expert Rev Anti Infect Ther","2021","2020/12/14","","","10.1080/14787210.2021.1863789"
"33823852","Gender-based disparities on health indices during COVID-19 crisis: a nationwide cross-sectional study in Jordan","Abufaraj M, Eyadat Z, Al-Sabbagh MQ, Nimer A, Moonesar IA, Yang L, Al Khatib W, Al-Qutob R.","Int J Equity Health. 2021 Apr 6;20(1):91. doi: 10.1186/s12939-021-01435-0.","Abufaraj M","Int J Equity Health","2021","2021/04/07","PMC8022313","","10.1186/s12939-021-01435-0"
"29318684","Nurses' work environment: indicators of satisfaction","Suliman M, Aljezawi M.","J Nurs Manag. 2018 Jul;26(5):525-530. doi: 10.1111/jonm.12577. Epub 2018 Jan 10.","Suliman M","J Nurs Manag","2018","2018/01/11","","","10.1111/jonm.12577"
"22214223","Prevalence and risk indicators of gingivitis and periodontitis in a multi-centre study in North Jordan: a cross sectional study","Ababneh KT, Abu Hwaij ZM, Khader YS.","BMC Oral Health. 2012 Jan 3;12:1. doi: 10.1186/1472-6831-12-1.","Ababneh KT","BMC Oral Health","2012","2012/01/05","PMC3271955","","10.1186/1472-6831-12-1"
"25325369","Patients' Adherence to Healthy Behavior in Coronary Heart Disease: Risk Factor Management Among Jordanian Patients","Mosleh SM, Darawad M.","J Cardiovasc Nurs. 2015 Nov-Dec;30(6):471-8. doi: 10.1097/JCN.0000000000000189.","Mosleh SM","J Cardiovasc Nurs","2015","2014/10/18","","","10.1097/JCN.0000000000000189"
"34081600","Clinical, Laboratory, and Imaging Features of COVID-19 in a Cohort of Patients: Cross-Sectional Comparative Study","Qaisieh R, Al-Tamimi M, El-Hammuri N, Shalabi M, Kilani MM, Taha H, Al-Muhtaseb A, Alfarrajin I, Abu Shaqra M, Hamdan A.","JMIR Public Health Surveill. 2021 Sep 21;7(9):e28005. doi: 10.2196/28005.","Qaisieh R","JMIR Public Health Surveill","2021","2021/06/03","PMC8457339","","10.2196/28005"
"28764682","Informing tobacco control policy in Jordan: assessing the effectiveness of pictorial warning labels on cigarette packs","Bader RK, Shihab RA, Al-Rimawi DH, Hawari FI.","BMC Public Health. 2017 Aug 1;18(1):84. doi: 10.1186/s12889-017-4642-8.","Bader RK","BMC Public Health","2017","2017/08/03","PMC5540564","","10.1186/s12889-017-4642-8"
"34582672","Work Stress, Coping Strategies, and Health-Related Quality of Life among Nurses at an International Specialized Cancer Center","Al-Ruzzieh MA, Ayaad O.","Asian Pac J Cancer Prev. 2021 Sep 1;22(9):2995-3004. doi: 10.31557/APJCP.2021.22.9.2995.","Al-Ruzzieh MA","Asian Pac J Cancer Prev","2021","2021/09/28","PMC8850895","","10.31557/APJCP.2021.22.9.2995"
"32875992","Vitamin B(12) Deficiency Among the Healthy Jordanian Adult Population: Diagnostic Levels, Symptomology and Risk Factors","Abu-Shanab A, Zihlif M, Rbeihat MN, Shkoukani ZW, Khamis A, Isleem U, Dardas LA.","Endocr Metab Immune Disord Drug Targets. 2021;21(6):1107-1114. doi: 10.2174/1871530320999200831230205.","Abu-Shanab A","Endocr Metab Immune Disord Drug Targets","2021","2020/09/03","","","10.2174/1871530320999200831230205"
"31134839","Retinoblastoma awareness among first contact physicians in Jordan","Yousef YA, AlNawaiseh T, AlJabari R, Muhsen S, Al-Nawaiseh I.","Ophthalmic Genet. 2019 Jun;40(3):191-195. doi: 10.1080/13816810.2019.1605387. Epub 2019 May 28.","Yousef YA","Ophthalmic Genet","2019","2019/05/29","","","10.1080/13816810.2019.1605387"
"26878988","A prospective study assessing the etiology of Diabetes mellitus among Jordanian patients","Suleiman AK.","Diabetes Metab Syndr. 2016 Apr-Jun;10(2 Suppl 1):S60-3. doi: 10.1016/j.dsx.2016.01.027. Epub 2016 Jan 14.","Suleiman AK","Diabetes Metab Syndr","2016","2016/02/17","","","10.1016/j.dsx.2016.01.027"
"25280546","Colorectal cancer in Jordan: prevention and care","Ahmad MM, Dardas L, Dardas L, Ahmad H.","Glob Health Promot. 2015 Dec;22(4):39-47. doi: 10.1177/1757975914547712. Epub 2014 Oct 3.","Ahmad MM","Glob Health Promot","2015","2014/10/05","","","10.1177/1757975914547712"
"19415972","Estimated burden of human Salmonella, Shigella, and Brucella infections in Jordan, 2003-2004","Gargouri N, Walke H, Belbeisi A, Hadadin A, Salah S, Ellis A, Braam HP, Angulo FJ.","Foodborne Pathog Dis. 2009 May;6(4):481-6. doi: 10.1089/fpd.2008.0192.","Gargouri N","Foodborne Pathog Dis","2009","2009/05/07","","","10.1089/fpd.2008.0192"
"20799595","Prevalence of overweight and obesity among adolescents in Irbid governorate, Jordan","Abu Baker NN, Daradkeh SM.","East Mediterr Health J. 2010 Jun;16(6):657-62.","Abu Baker NN","East Mediterr Health J","2010","2010/08/31","","",""
"26932303","High prevalence of self-medication practices among medical and pharmacy students: a study from Jordan","Alkhatatbeh MJ, Alefan Q, Alqudah MA.","Int J Clin Pharmacol Ther. 2016 May;54(5):390-8. doi: 10.5414/CP202451.","Alkhatatbeh MJ","Int J Clin Pharmacol Ther","2016","2016/03/03","","","10.5414/CP202451"
"23812947","Health-related quality of life and physical, mental, and cognitive disabilities among nursing home residents in Jordan","Almomani FM, McDowd JM, Bani-Issa W, Almomani M.","Qual Life Res. 2014 Feb;23(1):155-65. doi: 10.1007/s11136-013-0461-2. Epub 2013 Jun 29.","Almomani FM","Qual Life Res","2014","2013/07/02","","","10.1007/s11136-013-0461-2"
"25265736","Measuring quality of life among colorectal cancer patients in Jordan","Mhaidat NM, Al-Wedyan TJ, Alzoubi KH, Al-Efan QM, Al-Azzam SI, Balas QA, Bataineh ZA.","J Palliat Care. 2014 Autumn;30(3):133-40.","Mhaidat NM","J Palliat Care","2014","2014/10/01","","",""
"28338813","Antibiotic prescribing for acute respiratory infections in children in Jordan","Ababneh MA, Al-Azzam SI, Ababneh R, Rababa'h AM, Demour SA.","Int Health. 2017 Mar 1;9(2):124-130. doi: 10.1093/inthealth/ihx003.","Ababneh MA","Int Health","2017","2017/03/25","","","10.1093/inthealth/ihx003"
"31133409","Nurses' Assessment Practices of Pain Among Critically Ill Patients","Hamdan KM.","Pain Manag Nurs. 2019 Oct;20(5):489-496. doi: 10.1016/j.pmn.2019.04.003. Epub 2019 May 24.","Hamdan KM","Pain Manag Nurs","2019","2019/05/29","","","10.1016/j.pmn.2019.04.003"
"18477097","Hepatitis needs assessment among Jordanian healthcare workers","Hassan ZM, Wahsheh MA, Shishani KR, Pryor ER.","Int Nurs Rev. 2008 Jun;55(2):142-7. doi: 10.1111/j.1466-7657.2007.00583.x.","Hassan ZM","Int Nurs Rev","2008","2008/05/15","","","10.1111/j.1466-7657.2007.00583.x"
"28412839","Awareness and Knowledge of Ovarian Cancer Symptoms and Risk Factors: A Survey of Jordanian Women","Freij M, Al Qadire M, Khadra M, ALBashtawy M, Tuqan W, Al Faqih M, Innabi A, Batiha AM, Alhalaiqa F, Abd El-Razek A.","Clin Nurs Res. 2018 Sep;27(7):826-840. doi: 10.1177/1054773817704749. Epub 2017 Apr 16.","Freij M","Clin Nurs Res","2018","2017/04/18","","","10.1177/1054773817704749"
"33008392","Distance learning in clinical medical education amid COVID-19 pandemic in Jordan: current situation, challenges, and perspectives","Al-Balas M, Al-Balas HI, Jaber HM, Obeidat K, Al-Balas H, Aborajooh EA, Al-Taher R, Al-Balas B.","BMC Med Educ. 2020 Oct 2;20(1):341. doi: 10.1186/s12909-020-02257-4.","Al-Balas M","BMC Med Educ","2020","2020/10/03","PMC7530879","","10.1186/s12909-020-02257-4"
"33906619","Occupational burnout and job satisfaction among physicians in times of COVID-19 crisis: a convergent parallel mixed-method study","Alrawashdeh HM, Al-Tammemi AB, Alzawahreh MK, Al-Tamimi A, Elkholy M, Al Sarireh F, Abusamak M, Elehamer NMK, Malkawi A, Al-Dolat W, Abu-Ismail L, Al-Far A, Ghoul I.","BMC Public Health. 2021 Apr 28;21(1):811. doi: 10.1186/s12889-021-10897-4.","Alrawashdeh HM","BMC Public Health","2021","2021/04/28","PMC8079229","","10.1186/s12889-021-10897-4"
"22257132","Arabic translation and cultural adaptation of the stigma-devaluation scale in Jordan","Dalky HF.","J Ment Health. 2012 Feb;21(1):72-82. doi: 10.3109/09638237.2011.629238.","Dalky HF","J Ment Health","2012","2012/01/20","","","10.3109/09638237.2011.629238"
"26025151","Evaluation of venous thromboembolism prophylaxis after the introduction of an institutional guideline: Extent of application and implementation of its recommendations","Gharaibeh L, Albsoul-Younes A, Younes N.","J Vasc Nurs. 2015 Jun;33(2):72-8. doi: 10.1016/j.jvn.2014.11.002.","Gharaibeh L","J Vasc Nurs","2015","2015/05/31","","","10.1016/j.jvn.2014.11.002"
"25158058","Hemodialysis: stressors and coping strategies","Ahmad MM, Al Nazly EK.","Psychol Health Med. 2015;20(4):477-87. doi: 10.1080/13548506.2014.952239. Epub 2014 Aug 26.","Ahmad MM","Psychol Health Med","2015","2014/08/27","","","10.1080/13548506.2014.952239"
"23703743","Jordanian dialysis patients' perceived exercise benefits and barriers: a correlation study","Darawad MW, Khalil AA.","Rehabil Nurs. 2013 Nov-Dec;38(6):315-22. doi: 10.1002/rnj.98. Epub 2013 May 23.","Darawad MW","Rehabil Nurs","2013","2013/05/25","","","10.1002/rnj.98"
"31672404","Nurses' knowledge and practice of pressure ulcer prevention and treatment: An observational study","Saleh MYN, Papanikolaou P, Nassar OS, Shahin A, Anthony D.","J Tissue Viability. 2019 Nov;28(4):210-217. doi: 10.1016/j.jtv.2019.10.005. Epub 2019 Oct 25.","Saleh MYN","J Tissue Viability","2019","2019/11/02","","","10.1016/j.jtv.2019.10.005"
"20930248","Jordanian dental students' knowledge and attitudes in regard to child physical abuse","Al-Jundi SH, Zawaideh FI, Al-Rawi MH.","J Dent Educ. 2010 Oct;74(10):1159-65.","Al-Jundi SH","J Dent Educ","2010","2010/10/09","","",""
"23167336","Awareness of general public towards cancer prostate and screening practice in Arabic communities: a comparative multi-center study","Arafa MA, Rabah DM, Wahdan IH.","Asian Pac J Cancer Prev. 2012;13(9):4321-6. doi: 10.7314/apjcp.2012.13.9.4321.","Arafa MA","Asian Pac J Cancer Prev","2012","2012/11/22","","","10.7314/apjcp.2012.13.9.4321"
"33711026","Anxiety, depression, stress, fear and social support during COVID-19 pandemic among Jordanian healthcare workers","Alnazly E, Khraisat OM, Al-Bashaireh AM, Bryant CL.","PLoS One. 2021 Mar 12;16(3):e0247679. doi: 10.1371/journal.pone.0247679. eCollection 2021.","Alnazly E","PLoS One","2021","2021/03/12","PMC7954309","","10.1371/journal.pone.0247679"
"20145539","Knowledge and beliefs of Jordanians toward colorectal cancer screening","Omran S, Ismail AA.","Cancer Nurs. 2010 Mar-Apr;33(2):141-8. doi: 10.1097/NCC.0b013e3181b823f3.","Omran S","Cancer Nurs","2010","2010/02/11","","","10.1097/NCC.0b013e3181b823f3"
"14682657","Factors associated with periodontal diseases in a dental teaching clinic population in northern Jordan","Khader YS, Rice JC, Lefante JJ.","J Periodontol. 2003 Nov;74(11):1610-7. doi: 10.1902/jop.2003.74.11.1610.","Khader YS","J Periodontol","2003","2003/12/20","","","10.1902/jop.2003.74.11.1610"
"20602685","Competence assessment of nursing graduates of Jordanian universities","Safadi R, Jaradeh M, Bandak A, Froelicher E.","Nurs Health Sci. 2010 Jun;12(2):147-54. doi: 10.1111/j.1442-2018.2009.00507.x.","Safadi R","Nurs Health Sci","2010","2010/07/07","","","10.1111/j.1442-2018.2009.00507.x"
"15603040","Frequency and types of skin disorders and associated diabetes mellitus in elderly Jordanians","Najdawi F, Fa'ouri M.","East Mediterr Health J. 2002 Jul-Sep;8(4-5):574-8.","Najdawi F","East Mediterr Health J","2002","2004/12/18","","",""
"24399836","Compliance with safe handling guidelines of antineoplastic drugs in Jordanian hospitals","Al-Azzam SI, Awawdeh BT, Alzoubi KH, Khader YS, Alkafajei AM.","J Oncol Pharm Pract. 2015 Feb;21(1):3-9. doi: 10.1177/1078155213517128. Epub 2014 Jan 7.","Al-Azzam SI","J Oncol Pharm Pract","2015","2014/01/09","","","10.1177/1078155213517128"
"27482872","Exploring Safety Culture in Jordanian Hospitals: A Baseline Study","Suliman M, Aljezawi M, AlBashtawy M, Fitzpatrick J, Aloush S, Al-Awamreh K.","J Nurs Care Qual. 2017 Jul/Sep;32(3):E1-E7. doi: 10.1097/NCQ.0000000000000218.","Suliman M","J Nurs Care Qual","2017","2016/08/03","","","10.1097/NCQ.0000000000000218"
"26799158","Health service utilization and access to medicines among Syrian refugee children in Jordan","Doocy S, Lyles E, Akhu-Zaheya L, Burton A, Weiss W.","Int J Health Plann Manage. 2016 Jan-Mar;31(1):97-112. doi: 10.1002/hpm.2336. Epub 2016 Jan 22.","Doocy S","Int J Health Plann Manage","2016","2016/01/23","PMC4819707","","10.1002/hpm.2336"
"24762171","Jordanian women's dissatisfaction with childbirth care","Mohammad KI, Alafi KK, Mohammad AI, Gamble J, Creedy D.","Int Nurs Rev. 2014 Jun;61(2):278-84. doi: 10.1111/inr.12102. Epub 2014 Apr 25.","Mohammad KI","Int Nurs Rev","2014","2014/04/26","","","10.1111/inr.12102"
"29781526","The correlation between occupational stress, coping strategies, and the levels of psychological distress among nurses working in mental health hospital in Jordan","Hasan AA, Tumah H.","Perspect Psychiatr Care. 2019 Apr;55(2):153-160. doi: 10.1111/ppc.12292. Epub 2018 May 21.","Hasan AA","Perspect Psychiatr Care","2019","2018/05/22","","","10.1111/ppc.12292"
"31639171","Medication histories documentation at the community pharmacy setting: A study from Jordan","Abu Farha R, Abu Hammour K, Mukattash T, Alqudah R, Aljanabi R.","PLoS One. 2019 Oct 22;14(10):e0224124. doi: 10.1371/journal.pone.0224124. eCollection 2019.","Abu Farha R","PLoS One","2019","2019/10/23","PMC6804956","","10.1371/journal.pone.0224124"
"32574313","Medical Students and COVID-19: Knowledge, Attitudes, and Precautionary Measures. A Descriptive Study From Jordan","Khasawneh AI, Humeidan AA, Alsulaiman JW, Bloukh S, Ramadan M, Al-Shatanawi TN, Awad HH, Hijazi WY, Al-Kammash KR, Obeidat N, Saleh T, Kheirallah KA.","Front Public Health. 2020 May 29;8:253. doi: 10.3389/fpubh.2020.00253. eCollection 2020.","Khasawneh AI","Front Public Health","2020","2020/06/24","PMC7274076","","10.3389/fpubh.2020.00253"
