PMID,Title,Authors,Citation,First Author,Journal/Book,Publication Year,Create Date,PMCID,NIHMS ID,DOI
"23481877","Awareness of patients who undergo cesarean section about venous thromboembolism prophylaxis","Alzoubi KH, Khassawneh BY, Obeidat B, Asfoor SS, Al-azzam SI.","J Vasc Nurs. 2013 Mar;31(1):15-20. doi: 10.1016/j.jvn.2012.07.001.","Alzoubi KH","J Vasc Nurs","2013","2013/03/14","","","10.1016/j.jvn.2012.07.001"
"30739654","Fast-food outlet availability and obesity: Considering variation by age and methodological diversity in 22,889 Yorkshire Health Study participants","Hobbs M, Griffiths C, Green MA, Jordan H, Saunders J, Christensen A, McKenna J.","Spat Spatiotemporal Epidemiol. 2019 Feb;28:43-53. doi: 10.1016/j.sste.2018.11.001. Epub 2018 Nov 15.","Hobbs M","Spat Spatiotemporal Epidemiol","2019","2019/02/12","","","10.1016/j.sste.2018.11.001"
"30041836","Parents' and Staff Perceptions of Parental Needs During a Child's Hospital Admission: An Australian Study","Foster M, Whitehead L, Arabiat D, Frost L.","J Pediatr Nurs. 2018 Nov-Dec;43:e2-e9. doi: 10.1016/j.pedn.2018.06.013. Epub 2018 Jul 21.","Foster M","J Pediatr Nurs","2018","2018/07/26","","","10.1016/j.pedn.2018.06.013"
"33138779","Patients' perception of the practice of anaesthesia in a teaching hospital in Northern Jordan: a survey","Bataineh AM, Qudaisat IY, El-Radaideh K, Alzoubi RA, Abu-Shehab MI.","BMC Anesthesiol. 2020 Nov 2;20(1):276. doi: 10.1186/s12871-020-01193-6.","Bataineh AM","BMC Anesthesiol","2020","2020/11/03","PMC7604332","","10.1186/s12871-020-01193-6"
"27578619","The correlation between plasma levels of oxytocin and betatrophin in non-diabetic and diabetic metabolic syndrome patients: A cross sectional study from Jordan","Al-Rawashdeh A, Kasabri V, Bulatova N, Akour A, Zayed A, Momani M, Khawaja N, Bustanji H, Hyasat D.","Diabetes Metab Syndr. 2017 Jan-Mar;11(1):59-67. doi: 10.1016/j.dsx.2016.08.008. Epub 2016 Aug 22.","Al-Rawashdeh A","Diabetes Metab Syndr","2017","2016/09/01","","","10.1016/j.dsx.2016.08.008"
"27392833","The development of the ICF vestibular environmental scale","Whitney SL, Alghadir A, Alghwiri A, Alshebber KM, Alshehri M, Furman JM, Mueller M, Grill E.","J Vestib Res. 2016 Jul 2;26(3):297-302. doi: 10.3233/VES-160580.","Whitney SL","J Vestib Res","2016","2016/07/10","","","10.3233/VES-160580"
"33422916","Serum vitamin d inversely correlates with depression scores in people with multiple sclerosis","El-Salem K, Khalil H, Al-Sharman A, Al-Mistarehi AH, Yassin A, Alhayk KA, Qawasmeh MA, Bashayreh SY, Kofahi RM, Obeidat AZ.","Mult Scler Relat Disord. 2021 Feb;48:102732. doi: 10.1016/j.msard.2020.102732. Epub 2021 Jan 2.","El-Salem K","Mult Scler Relat Disord","2021","2021/01/10","","","10.1016/j.msard.2020.102732"
"21226851","Pilot pathfinder survey of oral hygiene and periodontal conditions in the rural population of The Gambia (West Africa)","Jordan RA, Lucaciu A, Fotouhi K, Markovic L, Gaengler P, Zimmer S.","Int J Dent Hyg. 2011 Feb;9(1):53-9. doi: 10.1111/j.1601-5037.2009.00435.x.","Jordan RA","Int J Dent Hyg","2011","2011/01/14","","","10.1111/j.1601-5037.2009.00435.x"
"28637579","Abortion: findings from women and men participating in the Understanding Fertility Management in contemporary Australia national survey","Rowe H, Holton S, Kirkman M, Bayly C, Jordan L, McNamee K, McBain J, Sinnott V, Fisher J.","Sex Health. 2017 Nov;14(6):566-573. doi: 10.1071/SH17004.","Rowe H","Sex Health","2017","2017/06/23","","","10.1071/SH17004"
"26673106","Associations with resuscitation choice: Do not resuscitate, full code or undecided","Jordan K, Elliott JO, Wall S, Saul E, Sheth R, Coffman J.","Patient Educ Couns. 2016 May;99(5):823-9. doi: 10.1016/j.pec.2015.11.027. Epub 2015 Dec 2.","Jordan K","Patient Educ Couns","2016","2015/12/18","","","10.1016/j.pec.2015.11.027"
"32416695","High Prevalence of Vitamin D Deficiency and Correlation with Cystatin-C and Other Cardiovascular and Renal Risk Biomarkers in Patients with Type 2 Diabetes Mellitus Complicated with Hypertension","Alkhatatbeh MJ, Smadi SA, Abdul-Razzak KK, Saadeh NA.","Curr Diabetes Rev. 2021;17(1):81-90. doi: 10.2174/1573399816666200516174352.","Alkhatatbeh MJ","Curr Diabetes Rev","2021","2020/05/18","","","10.2174/1573399816666200516174352"
"25204478","The second study on WHO MPOWER tobacco control scores in Eastern Mediterranean Countries based on the 2013 report: improvements over two years","Heydari G, Ebn Ahmady A, Lando HA, Shadmehr MB, Fadaizadeh L.","Arch Iran Med. 2014 Sep;17(9):621-5.","Heydari G","Arch Iran Med","2014","2014/09/11","","",""
"31096949","Knowledge, attitude and practices among parents regarding food poisoning: a cross-sectional study from Palestine","Zyoud S, Shalabi J, Imran K, Ayaseh L, Radwany N, Salameh R, Sa'dalden Z, Sharif L, Sweileh W, Awang R, Al-Jabi S.","BMC Public Health. 2019 May 16;19(1):586. doi: 10.1186/s12889-019-6955-2.","Zyoud S","BMC Public Health","2019","2019/05/18","PMC6524328","","10.1186/s12889-019-6955-2"
"21241247","Adverse effects of tacrolimus in renal transplant patients from living donors","Bulatova N, Yousef AM, Al-Khayyat G, Qosa H.","Curr Drug Saf. 2011 Feb 1;6(1):3-11. doi: 10.2174/157488611794480043.","Bulatova N","Curr Drug Saf","2011","2011/01/19","","","10.2174/157488611794480043"
"30754982","Differential Associations Between Anti-Tobacco Industry Attitudes and Intention to Quit Smoking Across Young Adult Peer Crowds","Nguyen N, Lisha NE, Neilands TB, Jordan JW, Ling PM.","Am J Health Promot. 2019 Jul;33(6):876-885. doi: 10.1177/0890117119829676. Epub 2019 Feb 12.","Nguyen N","Am J Health Promot","2019","2019/02/14","PMC6625858","NIHMS1014491","10.1177/0890117119829676"
"29502757","Duration of untreated illness in patients with somatoform disorders","Herzog A, Shedden-Mora MC, Jordan P, Löwe B.","J Psychosom Res. 2018 Apr;107:1-6. doi: 10.1016/j.jpsychores.2018.01.011. Epub 2018 Jan 31.","Herzog A","J Psychosom Res","2018","2018/03/06","","","10.1016/j.jpsychores.2018.01.011"
"19419527","The psychological burden of patients with beta thalassemia major in Syria","Gharaibeh H, Amarneh BH, Zamzam SZ.","Pediatr Int. 2009 Oct;51(5):630-6. doi: 10.1111/j.1442-200X.2009.02833.x. Epub 2009 Mar 27.","Gharaibeh H","Pediatr Int","2009","2009/05/08","","","10.1111/j.1442-200X.2009.02833.x"
"14558062","Critical review of arthritis self-management strategy use","Keysor JJ, DeVellis BM, DeFriese GH, DeVellis RF, Jordan JM, Konrad TR, Mutran EJ, Callahan LF.","Arthritis Rheum. 2003 Oct 15;49(5):724-31. doi: 10.1002/art.11369.","Keysor JJ","Arthritis Rheum","2003","2003/10/15","","","10.1002/art.11369"
"34348682","Determination of hand grip strength and its correlates during pregnancy: a cross-sectional study","Abdullahi A, Bala AS, Danazumi SM, Abubakar SM, Adamu RI, Truijen S, Zakari MK, Akosile CO, Saeys W, Lawal IU, Etoom M, Nuhu JM, Oyeniran MA, Mayana KI, Useh U.","BMC Pregnancy Childbirth. 2021 Aug 4;21(1):540. doi: 10.1186/s12884-021-04003-0.","Abdullahi A","BMC Pregnancy Childbirth","2021","2021/08/05","PMC8340369","","10.1186/s12884-021-04003-0"
"26573487","Models of care for musculoskeletal health: a cross-sectional qualitative study of Australian stakeholders' perspectives on relevance and standardised evaluation","Briggs AM, Jordan JE, Speerin R, Jennings M, Bragge P, Chua J, Slater H.","BMC Health Serv Res. 2015 Nov 16;15:509. doi: 10.1186/s12913-015-1173-9.","Briggs AM","BMC Health Serv Res","2015","2015/11/18","PMC4647615","","10.1186/s12913-015-1173-9"
"23777729","Health-risk factors and the prevalence of hypertension: cross-sectional findings from a national cohort of 87,143 Thai Open University students","Thawornchaisit P, de Looze F, Reid CM, Seubsman SA, Sleigh A; Thai Cohort Study Team.","Glob J Health Sci. 2013 May 1;5(4):126-41. doi: 10.5539/gjhs.v5n4p126.","Thawornchaisit P","Glob J Health Sci","2013","2013/06/20","PMC4776825","","10.5539/gjhs.v5n4p126"
"22811218","Factors associated with uptake of pandemic influenza vaccine among general practitioners and practice nurses in Shropshire, UK","Hothersall EJ, de Bellis-Ayres S, Jordan R.","Prim Care Respir J. 2012 Sep;21(3):302-7. doi: 10.4104/pcrj.2012.00056.","Hothersall EJ","Prim Care Respir J","2012","2012/07/20","PMC6547956","","10.4104/pcrj.2012.00056"
"28944405","Knowledge and Attitudes Toward Cancer Pain Management Among Nurses at Oncology Units","Alnajar MK, Darawad MW, Alshahwan SS, Samarkandi OA.","J Cancer Educ. 2019 Feb;34(1):186-193. doi: 10.1007/s13187-017-1285-5.","Alnajar MK","J Cancer Educ","2019","2017/09/26","","","10.1007/s13187-017-1285-5"
"32605846","Discomfort of the critically ill paediatric patient and correlated variables","Bosch-Alcaraz A, Jordan I, Benito-Aracil L, Saz-Roy MÁ, Falcó-Pegueroles A.","Aust Crit Care. 2020 Nov;33(6):504-510. doi: 10.1016/j.aucc.2020.02.009. Epub 2020 Jun 27.","Bosch-Alcaraz A","Aust Crit Care","2020","2020/07/02","","","10.1016/j.aucc.2020.02.009"
"34602492","Mental and physical health-related quality of life and their associated factors among students of a comprehensive allied health institution","Almhdawi KA, Kanaan SF, Khader Y, Al-Hourani Z, Al-Jarrah MD, Almomani F, Alqhazo MT.","Work. 2021;70(1):63-73. doi: 10.3233/WOR-205226.","Almhdawi KA","Work","2021","2021/10/04","","","10.3233/WOR-205226"
"32511715","Diagnosis of deep vein thrombosis of the upper extremity: a systematic review and meta-analysis of test accuracy","Patel P, Braun C, Patel P, Bhatt M, Begum H, Wiercioch W, Varghese J, Wooldridge D, Alturkmani HJ, Thomas M, Baig M, Bahaj W, Khatib R, Kehar R, Ponnapureddy R, Sethi A, Mustafa A, Lim W, Le Gal G, Bates SM, Lang E, Righini M, Husainat NM, Kalot MA, Al Jabiri YN, Nieuwlaat R, Schünemann HJ, Mustafa RA.","Blood Adv. 2020 Jun 9;4(11):2516-2522. doi: 10.1182/bloodadvances.2019001409.","Patel P","Blood Adv","2020","2020/06/09","PMC7284086","","10.1182/bloodadvances.2019001409"
"25185681","Determinants of health check attendance in adults: findings from the cross-sectional German Health Update (GEDA) study","Hoebel J, Starker A, Jordan S, Richter M, Lampert T.","BMC Public Health. 2014 Sep 4;14:913. doi: 10.1186/1471-2458-14-913.","Hoebel J","BMC Public Health","2014","2014/09/05","PMC4167266","","10.1186/1471-2458-14-913"
"29490562","Investigating cardiovascular patients' preferences and expectations regarding the use of social media in health education","Eshah NF.","Contemp Nurse. 2018 Feb;54(1):52-63. doi: 10.1080/10376178.2018.1444497. Epub 2018 Mar 12.","Eshah NF","Contemp Nurse","2018","2018/03/02","","","10.1080/10376178.2018.1444497"
"28462932","Health care utilization in persons with spinal cord injury: part 1-outpatient services","Gemperli A, Ronca E, Scheel-Sailer A, Koch HG, Brach M, Trezzini B; SwiSCI Study Group.","Spinal Cord. 2017 Sep;55(9):823-827. doi: 10.1038/sc.2017.44. Epub 2017 May 2.","Gemperli A","Spinal Cord","2017","2017/05/03","","","10.1038/sc.2017.44"
"34580723","Public health workers' knowledge, attitude and practice regarding COVID-19: the impact of Field Epidemiology Training Program in the Eastern Mediterranean Region","Samy S, Lami F, Rashak HA, Al Nsour M, Eid A, Khader YS, Afifi S, Elfadul M, Ghaleb Y, Letaief H, Alaya NB, Ikram A, Akhtar H, Barkia A, Taha HA, Adam R, Saeed KMI, Almudarra SS, Hassany M, El Sood HA, Ur Rahman F, Saaed FA, Hlaiwah MS.","J Public Health (Oxf). 2021 Dec 8;43(Suppl 3):iii1-iii11. doi: 10.1093/pubmed/fdab240.","Samy S","J Public Health (Oxf)","2021","2021/09/28","PMC8500047","","10.1093/pubmed/fdab240"
"24882440","Knowledge, experiences, and barriers to colorectal cancer screening: a survey of health care providers working in primary care settings","Omran S, Barakat H, Muliira JK, Aljadaa N.","J Cancer Educ. 2015 Mar;30(1):53-61. doi: 10.1007/s13187-014-0676-0.","Omran S","J Cancer Educ","2015","2014/06/03","","","10.1007/s13187-014-0676-0"
"23057368","Comparison of tobacco control policies in the Eastern Mediterranean countries based on Tobacco Control Scale scores","Heydari G, Talischi F, Masjedi MR, Alguomani H, Joossens L, Ghafari M.","East Mediterr Health J. 2012 Aug;18(8):803-10. doi: 10.26719/2012.18.8.803.","Heydari G","East Mediterr Health J","2012","2012/10/13","","","10.26719/2012.18.8.803"
"26180223","Social Branding to Decrease Lesbian, Gay, Bisexual, and Transgender Young Adult Smoking","Fallin A, Neilands TB, Jordan JW, Ling PM.","Nicotine Tob Res. 2015 Aug;17(8):983-9. doi: 10.1093/ntr/ntu265.","Fallin A","Nicotine Tob Res","2015","2015/07/17","PMC4580542","","10.1093/ntr/ntu265"
"23882955","WHO MPOWER tobacco control scores in the Eastern Mediterranean countries based on the 2011 report","Heydari G, Talischi F, Algouhmani H, Lando HA, Ahmady AE.","East Mediterr Health J. 2013 Apr;19(4):314-9.","Heydari G","East Mediterr Health J","2013","2013/07/26","","",""
"33735637","Rehabilitation duration and time of starting sport-related activities associated with return to the previous level of sports after anterior cruciate ligament reconstruction","Yabroudi MA, Bashaireh K, Nawasreh ZH, Snyder-Mackler L, Logerstedt D, Maayah M.","Phys Ther Sport. 2021 May;49:164-170. doi: 10.1016/j.ptsp.2021.02.014. Epub 2021 Mar 5.","Yabroudi MA","Phys Ther Sport","2021","2021/03/18","","","10.1016/j.ptsp.2021.02.014"
"31190178","Child and adolescent psychiatry training and services in the Middle East region: a current status assessment","Clausen CE, Bazaid K, Azeem MW, Abdelrahim F, Elgawad AAA, Alamiri B, AlAnsari AM, Alhamzawi A, Al Mai AM, Bakhiet AM, Bashtawi M, Çuhadaroğlu F, Hedar M, Holdar M, Jabr S, Jafri AS, Jumaian A, Moussa S, Osman AH, Razjouyan K, Yanes E, Guerrero A, Skokauskas N; Consortium on Academic Child, Adolescent Psychiatry in the Middle East (CACAP ME).","Eur Child Adolesc Psychiatry. 2020 Jan;29(1):51-61. doi: 10.1007/s00787-019-01360-2. Epub 2019 Jun 12.","Clausen CE","Eur Child Adolesc Psychiatry","2020","2019/06/14","","","10.1007/s00787-019-01360-2"
"20298606","Limited educational attainment and radiographic and symptomatic knee osteoarthritis: a cross-sectional analysis using data from the Johnston County (North Carolina) Osteoarthritis Project","Callahan LF, Shreffler J, Siaton BC, Helmick CG, Schoster B, Schwartz TA, Chen JC, Renner JB, Jordan JM.","Arthritis Res Ther. 2010;12(2):R46. doi: 10.1186/ar2956. Epub 2010 Mar 18.","Callahan LF","Arthritis Res Ther","2010","2010/03/20","PMC2888194","","10.1186/ar2956"
"28576335","Kuwaiti Teachers' Perceptions of Voice Handicap","Albustan SA, Marie BS, Natour YS, Darawsheh WB.","J Voice. 2018 May;32(3):319-324. doi: 10.1016/j.jvoice.2017.05.003. Epub 2017 May 30.","Albustan SA","J Voice","2018","2017/06/04","","","10.1016/j.jvoice.2017.05.003"
"32499269","EUPRON: nurses' practice in interprofessional pharmaceutical care in Europe. A cross-sectional survey in 17 countries","De Baetselier E, Van Rompaey B, Batalha LM, Bergqvist M, Czarkowska-Paczek B, De Santis A, Dijkstra NE, Fernandes MI, Filov I, Grøndahl VA, Heczkova J, Helgesen AK, Isfort M, Jordan S, Karnjus I, Keeley S, Kolovos P, Langer G, Lillo-Crespo M, Logan V, Malara A, Meyer G, Olah A, Padysakova H, Prosen M, Pusztai D, Sino CG, Tziaferi S, Ziakova E, Dilles T.","BMJ Open. 2020 Jun 3;10(6):e036269. doi: 10.1136/bmjopen-2019-036269.","De Baetselier E","BMJ Open","2020","2020/06/06","PMC7282395","","10.1136/bmjopen-2019-036269"
"32071399","The double burden of malnutrition in Vietnamese school-aged children and adolescents: a rapid shift over a decade in Ho Chi Minh City","Mai TMT, Pham NO, Tran TMH, Baker P, Gallegos D, Do TND, van der Pols JC, Jordan SJ.","Eur J Clin Nutr. 2020 Oct;74(10):1448-1456. doi: 10.1038/s41430-020-0587-6. Epub 2020 Feb 18.","Mai TMT","Eur J Clin Nutr","2020","2020/02/20","","","10.1038/s41430-020-0587-6"
"34344516","Dietetic Workforce Capacity Assessment for Public Health Nutrition and Community Nutrition","El-Kour TY, Kelley K, Bruening M, Robson S, Vogelzang J, Yang J, Jimenez EY.","J Acad Nutr Diet. 2021 Jul;121(7):1379-1391.e21. doi: 10.1016/j.jand.2020.08.078. Epub 2020 Oct 21.","El-Kour TY","J Acad Nutr Diet","2021","2021/08/04","PMC7577731","","10.1016/j.jand.2020.08.078"
"24328626","Secondhand smoke exposure among young adult sexual minority bar and nightclub patrons","Fallin A, Neilands TB, Jordan JW, Ling PM.","Am J Public Health. 2014 Feb;104(2):e148-53. doi: 10.2105/AJPH.2013.301657. Epub 2013 Dec 12.","Fallin A","Am J Public Health","2014","2013/12/17","PMC3935689","NIHMS587549","10.2105/AJPH.2013.301657"
"26423746","A cross-sectional study on health differences between rural and non-rural U.S. counties using the County Health Rankings","Anderson TJ, Saman DM, Lipsky MS, Lutfiyya MN.","BMC Health Serv Res. 2015 Oct 1;15:441. doi: 10.1186/s12913-015-1053-3.","Anderson TJ","BMC Health Serv Res","2015","2015/10/02","PMC4590732","","10.1186/s12913-015-1053-3"
"32040366","Wellbeing and quality of life of family caregivers: influence of sleep quality","Al-Rawashdeh S, Alshraifeen A, Alhawamdih S, Ashour A.","Br J Community Nurs. 2020 Feb 2;25(2):70-75. doi: 10.12968/bjcn.2020.25.2.70.","Al-Rawashdeh S","Br J Community Nurs","2020","2020/02/11","","","10.12968/bjcn.2020.25.2.70"
"35056325","Arab Women Adherence to the Mediterranean Diet and Insomnia","Zaidalkilani AT, Alhaj OA, Serag El-Dine MF, Fekih-Romdhane F, AlRasheed MM, Jahrami HA, Bragazzi NL.","Medicina (Kaunas). 2021 Dec 23;58(1):17. doi: 10.3390/medicina58010017.","Zaidalkilani AT","Medicina (Kaunas)","2021","2022/01/21","PMC8778319","","10.3390/medicina58010017"
"14966241","The Index of Multiple Deprivation 2000 and accessibility effects on health","Jordan H, Roderick P, Martin D.","J Epidemiol Community Health. 2004 Mar;58(3):250-7. doi: 10.1136/jech.2003.013011.","Jordan H","J Epidemiol Community Health","2004","2004/02/18","PMC1732697","","10.1136/jech.2003.013011"
"32229462","Occupational Exposure to Needle Stick Injuries and Hepatitis B Vaccination Coverage Among Clinical Laboratory Staff in Sana'a, Yemen: Cross-Sectional Study","Al-Abhar N, Moghram GS, Al-Gunaid EA, Al Serouri A, Khader Y.","JMIR Public Health Surveill. 2020 Mar 31;6(1):e15812. doi: 10.2196/15812.","Al-Abhar N","JMIR Public Health Surveill","2020","2020/04/02","PMC7157492","","10.2196/15812"
"34664528","Anthropometric indices of obesity as predictors of high blood pressure among school children","Al Hourani HM, Alkhatib B.","Clin Exp Hypertens. 2022 Jan 2;44(1):11-19. doi: 10.1080/10641963.2021.1969662. Epub 2021 Oct 19.","Al Hourani HM","Clin Exp Hypertens","2022","2021/10/19","","","10.1080/10641963.2021.1969662"
"19930073","Young Syrian adults' knowledge, perceptions and attitudes to premarital testing","Gharaibeh H, Mater FK.","Int Nurs Rev. 2009 Dec;56(4):450-5. doi: 10.1111/j.1466-7657.2009.00736.x.","Gharaibeh H","Int Nurs Rev","2009","2009/11/26","","","10.1111/j.1466-7657.2009.00736.x"
"28202744","A Cross-sectional Analysis of Radiographic Ankle Osteoarthritis Frequency and Associated Factors: The Johnston County Osteoarthritis Project","Lateef S, Golightly YM, Renner JB, Jordan JM, Nelson AE.","J Rheumatol. 2017 Apr;44(4):499-504. doi: 10.3899/jrheum.161076. Epub 2017 Feb 15.","Lateef S","J Rheumatol","2017","2017/02/17","PMC5468490","NIHMS841346","10.3899/jrheum.161076"
"31496680","Respiratory health and quality of life in young exclusive, habitual smokers - a comparison of waterpipe smokers, cigarette smokers and non-smokers","Hawari FI, Obeidat NA, Abu Alhalawa M, Al-Busaidi Z, Amara B, Baddar S, Elhabiby M, Elkholy H.","Int J Chron Obstruct Pulmon Dis. 2019 Aug 13;14:1813-1824. doi: 10.2147/COPD.S205050. eCollection 2019.","Hawari FI","Int J Chron Obstruct Pulmon Dis","2019","2019/09/10","PMC6698154","","10.2147/COPD.S205050"
"32316748","US database study: burden and healthcare resource utilization in adults with systemic endemic mycoses and aspergillosis","Forsythe A, Lewis G, Jordan R, Thompson GR 3rd.","J Comp Eff Res. 2020 Jun;9(8):573-584. doi: 10.2217/cer-2020-0019. Epub 2020 Apr 22.","Forsythe A","J Comp Eff Res","2020","2020/04/23","","","10.2217/cer-2020-0019"
"29305283","Evidence-based guidelines for prevention of ventilator-associated pneumonia: Evaluation of intensive care unit nurses' adherence","Darawad MW, Sa'aleek MA, Shawashi T.","Am J Infect Control. 2018 Jun;46(6):711-713. doi: 10.1016/j.ajic.2017.11.020. Epub 2018 Jan 2.","Darawad MW","Am J Infect Control","2018","2018/01/07","","","10.1016/j.ajic.2017.11.020"
"30011949","Oral Symptoms and Oral Health-Related Quality of Life in People with Rare Diseases in Germany: A Cross-Sectional Study","Wiemann S, Frenzel Baudisch N, Jordan RA, Kleinheinz J, Hanisch M.","Int J Environ Res Public Health. 2018 Jul 15;15(7):1493. doi: 10.3390/ijerph15071493.","Wiemann S","Int J Environ Res Public Health","2018","2018/07/18","PMC6068528","","10.3390/ijerph15071493"
"35162469","COVID-19-Associated Mental Health Impact on Menstrual Function Aspects: Dysmenorrhea and Premenstrual Syndrome, and Genitourinary Tract Health: A Cross Sectional Study among Jordanian Medical Students","Aolymat I, Khasawneh AI, Al-Tamimi M.","Int J Environ Res Public Health. 2022 Jan 27;19(3):1439. doi: 10.3390/ijerph19031439.","Aolymat I","Int J Environ Res Public Health","2022","2022/02/15","PMC8834694","","10.3390/ijerph19031439"
"22000702","Comparison of intraocular pressure measurement using 4 different instruments following penetrating keratoplasty","Chou CY, Jordan CA, McGhee CN, Patel DV.","Am J Ophthalmol. 2012 Mar;153(3):412-8. doi: 10.1016/j.ajo.2011.08.020. Epub 2011 Oct 13.","Chou CY","Am J Ophthalmol","2012","2011/10/18","","","10.1016/j.ajo.2011.08.020"
"31178438","Questionnaire survey on medical futility and termination of resuscitation in cardiac arrest patients among emergency physicians in Hong Kong","So CW, Lui CT, Tsui KL, Chan KL, Law AKK, Wong YK, Li T, Wong CL, Leung SC.","Hong Kong Med J. 2019 Jun;25(3):183-191. doi: 10.12809/hkmj187755. Epub 2019 May 29.","So CW","Hong Kong Med J","2019","2019/06/11","","","10.12809/hkmj187755"
"27984407","Organizational characteristics associated with the provision of cultural competency training in home and hospice care agencies","AbuDagga A, Weech-Maldonado R, Tian F.","Health Care Manage Rev. 2018 Oct/Dec;43(4):328-337. doi: 10.1097/HMR.0000000000000144.","AbuDagga A","Health Care Manage Rev","2018","2016/12/17","PMC5472501","NIHMS825589","10.1097/HMR.0000000000000144"
"28859591","Assessing Implementation Readiness and Success of an e-Resource to Improve Prelicensure Physical Therapy Workforce Capacity to Manage Rheumatoid Arthritis","Fary RE, Slater H, Jordan JE, Gardner P, Chua J, Payne C, Briggs AM.","J Orthop Sports Phys Ther. 2017 Sep;47(9):652-663. doi: 10.2519/jospt.2017.7281.","Fary RE","J Orthop Sports Phys Ther","2017","2017/09/02","","","10.2519/jospt.2017.7281"
"26592372","Literature Review and Profile of Cancer Diseases Among Afghan Refugees in Iran: Referrals in Six Years of Displacement","Otoukesh S, Mojtahedzadeh M, Figlin RA, Rosenfelt FP, Behazin A, Sherzai D, Cooper CJ, Nahleh ZA.","Med Sci Monit. 2015 Nov 23;21:3622-8. doi: 10.12659/msm.895173.","Otoukesh S","Med Sci Monit","2015","2015/11/24","PMC4662241","","10.12659/msm.895173"
"33643995","COVID-19 Vaccination Acceptance and Its Associated Factors Among a Middle Eastern Population","Al-Qerem WA, Jarab AS.","Front Public Health. 2021 Feb 10;9:632914. doi: 10.3389/fpubh.2021.632914. eCollection 2021.","Al-Qerem WA","Front Public Health","2021","2021/03/01","PMC7902782","","10.3389/fpubh.2021.632914"
"26503585","Prevalence and temporal trends of physical activity counselling in primary health care in Germany from 1997-1999 to 2008-2011","Gabrys L, Jordan S, Schlaud M.","Int J Behav Nutr Phys Act. 2015 Oct 26;12:136. doi: 10.1186/s12966-015-0299-9.","Gabrys L","Int J Behav Nutr Phys Act","2015","2015/10/28","PMC4624583","","10.1186/s12966-015-0299-9"
"34784384","Trends, wealth inequalities and the role of the private sector in caesarean section in the Middle East and North Africa: A repeat cross-sectional analysis of population-based surveys","McCall SJ, Semaan A, Altijani N, Opondo C, Abdel-Fattah M, Kabakian-Khasholian T.","PLoS One. 2021 Nov 16;16(11):e0259791. doi: 10.1371/journal.pone.0259791. eCollection 2021.","McCall SJ","PLoS One","2021","2021/11/16","PMC8594794","","10.1371/journal.pone.0259791"
"32007985","Work-related musculoskeletal disorders in nurses working in the Kingdom of Saudi Arabia","Tariah HA, Nafai S, Alajmi M, Almutairi F, Alanazi B.","Work. 2020;65(2):421-428. doi: 10.3233/WOR-203094.","Tariah HA","Work","2020","2020/02/03","","","10.3233/WOR-203094"
"20506115","Cross-sectional comparison of extended anteroposterior and posteroanterior fixed flexion positioning to assess radiographic osteoarthritis at the knee: the Johnston County Osteoarthritis Project","Nelson AE, Renner JB, Shi XA, Shreffler JH, Schwartz TA, Jordan JM.","Arthritis Care Res (Hoboken). 2010 Sep;62(9):1342-5. doi: 10.1002/acr.20210.","Nelson AE","Arthritis Care Res (Hoboken)","2010","2010/05/28","PMC2939919","NIHMS207923","10.1002/acr.20210"
"33324599","Prevalence of Workaholism Among Egyptian Healthcare Workers With Assessment of Its Relation to Quality of Life, Mental Health and Burnout","Kasemy ZA, Abd-Ellatif EE, Abdel Latif AA, Bahgat NM, Shereda HMA, Shattla SI, Aboalizm SE, Abd Elhy AH, Allam AR, Ramadan AN, Amer HM, Ahmed NA, AlJifri AA, El Dalatony MM.","Front Public Health. 2020 Nov 26;8:581373. doi: 10.3389/fpubh.2020.581373. eCollection 2020.","Kasemy ZA","Front Public Health","2020","2020/12/16","PMC7725873","","10.3389/fpubh.2020.581373"
